bank_number_key,title_en,title_fr,bank_number_en,bank_number_fr,description_en,description_fr,class_of_individuals_en,class_of_individuals_fr,note_en,note_fr,social_insurance_number_en,social_insurance_number_fr,purpose_en,purpose_fr,consistent_uses_en,consistent_uses_fr,retention_and_disposal_standards_en,retention_and_disposal_standards_fr,rda_number_en,rda_number_fr,related_record_number_en,related_record_number_fr,last_updated_en,last_updated_fr,tbs_registration_en,tbs_registration_fr
PHAC PPU 073,Border and Travel Health,Santé des voyageurs et santé transfrontalière,PHAC PPU 073,ASPC PPU 073,"This bank describes information collected in support of the designation process for Yellow Fever Vaccination Centers (YFVC) in Canada. Personal information includes name, contact information and professional accreditation/license information.","Ce fichier décrit les renseignements recueillis à l'appui du processus de désignation des centres de vaccination contre la fièvre jaune (CVFJ) au Canada. Les renseignements personnels comprennent le nom, les coordonnées et les renseignements sur l'accréditation ou la licence professionnelle.",Individuals who apply to be as site-specific responsible health care practitioners.,Personnes qui présentent une demande pour devenir des praticiens de la santé responsables propres à un site.,,,,,The information is used to assess applications for the designation and re-designation of YFVCs. The personal information is collected under the authority of section 3 of the *Public Health Agency of Canada Act* and section 4 of the *Department of Health Act*.,L'information est utilisée pour évaluer les demandes de désignation et de nouvelle désignation des CVFJ. Les renseignements personnels sont recueillis en vertu de l'article 3 de la Loi sur l'Agence de la santé publique du Canada et de l'article 4 de la Loi sur le ministère de la Santé.,"The location of the YFVC will be posted on the [PHAC website](/en/public-health/services/travel-health/yellow-fever.html), including address and phone number. In some cases, this will reflect an individual's contact information. Information will be also used to inform policy and brief senior management.","L'emplacement du CVFJ sera affiché sur le site [Web de l'ASPC](/fr/sante-publique/services/sante-voyageurs/fievre-jaune.html), y compris l'adresse et le numéro de téléphone. Dans certains cas, ces renseignements refléteront les coordonnées de la personne-ressource et seront également utilisés pour documenter les politiques et informer la haute direction.",Two years following the last administrative action.,Deux ans après la dernière action administrative.,2015/022,2015/022 **Renvoi à la catégorie de documents no :** ASPC 010 0054,PHAC 010 0054,,,,20210076,20210076
PHAC PPU 072,Traveling Public Program,Programme du public voyageur,PHAC PPU 072,ASPC PPU 072,"This bank describes information that is related to public health inspections, responses to outbreaks, and other public health events. The Public Health Agency of Canada operates an inspection program for federally regulated conveyances and their ancillary services to mitigate health risks for people travelling into, out of and within Canada by overseeing the provision of safe food and potable water, and maintenance of appropriate sanitation levels on passenger conveyances. Activities are carried out on domestic and international passenger conveyances such as cruise ships, ferries, trains, and aircraft. Personal information may be received from the public or a conveyance crew member who is reporting a public health event, or during follow-up of an inspection or response activity from passenger interviews and questionnaires. Personal information may include name, age, sex, contact information, travel information, medical information, symptoms and medical test results as they relate to communicable disease outbreaks, or responses to questionnaires and/or interviews with persons who may have contracted, or are at risk of contracting, any food borne or waterborne illness while on board a passenger conveyance.","Ce fichier décrit l'information liée aux inspections en matière de santé publique et aux interventions lors d'épidémies et à d'autres événements de santé publique. L'Agence de la santé publique du Canada gère un programme d'inspection des moyens de transport sous réglementation fédérale et de leurs services auxiliaires afin d'atténuer les risques pour la santé des personnes qui se rendent au Canada ou à l'étranger ou voyagent à l'intérieur du Canada en supervisant la fourniture d'aliments salubres et d'eau potable, ainsi que le maintien de niveaux d'assainissement appropriés sur les moyens de transport de passagers. Les activités sont exercées sur les moyens de transport de passagers intérieurs et internationaux tels que les navires de croisière, les traversiers, les trains et les avions. Les renseignements personnels peuvent être reçus du public ou d'un membre de l'équipage d'un moyen de transport qui signale un événement de santé publique, ou lors du suivi d'une inspection ou d'une activité d'intervention à partir d'entretiens avec les passagers et de questionnaires. Les renseignements personnels peuvent comprendre le nom, l'âge, le sexe, les coordonnées, les renseignements sur les voyages, les renseignements médicaux, les symptômes et les résultats de tests médicaux liés à des éclosions de maladies transmissibles, ou les réponses à des questionnaires et/ou à des entretiens avec des personnes susceptibles d'avoir contracté ou qui risquent de contracter une maladie d'origine alimentaire ou hydrique à bord d'un moyen de transport de passagers.","Passengers and crews of federally-regulated conveyances whose personal information has been collected during public health inspections, responses to outbreaks and other public health events.","Passagers et équipages de moyens de transport sous réglementation fédérale dont les renseignements personnels ont été recueillis lors d'inspections de santé publique, d'interventions lors d'épidémies et d'autres événements de santé publique.",,,,,"The personal information may be used during any follow-up to an outbreak or other public health event that occurs on passenger conveyances, to identify the source of illness, inform any intervention required, and to recommend infection and prevention control measures. The personal information is collected pursuant to Department of Health Act, Quarantine Act and Food and Drugs Act.","Les renseignements personnels peuvent être utilisés lors de tout suivi d'une épidémie ou d'un autre événement de santé publique qui survient dans les moyens de transport de passagers pour déterminer la source de la maladie, éclairer toute intervention requise et recommander des mesures de contrôle des infections et de prévention. Les renseignements personnels sont recueillis en vertu de la *Loi sur le ministère de la Santé*, de la *Loi sur la mise en quarantaine* et de la *Loi sur les aliments et drogues","The information may be disclosed by the Travelling Public Program to other programs within the Public Health Agency of Canada to aid in the response to outbreaks or other public health events on conveyances. Under subsection 40.2(3) of the *Quarantine Act*, personal information may be released to a provincial public health authority to prevent the spread of communicable disease.","Les renseignements peuvent être communiqués par le Programme du public voyageur à d'autres programmes au sein de l'Agence de la santé publique du Canada pour faciliter les interventions en cas d'épidémie ou d'autres événements de santé publique à bord des moyens de transport. En vertu du paragraphe 40.2(3) de la *Loi sur la mise en quarantaine*, les renseignements personnels peuvent être communiqués à une autorité de santé publique provinciale afin de prévenir la propagation d'une maladie transmissible",Two years following the last administrative action.,Deux ans après la dernière action administrative.,2015/022,2015/022 **Renvoi à la catégorie de documents no :** ASPC 010 0053,PHAC 010 0053,,,,004065,004065
PHAC PPU 305,Emergency Preparedness and Response,Planification d'urgence et personnel d'intervention dans les transports,PHAC PPU 305,ASPC PPU 305,"This bank describes information that is related to the qualifications and training of personnel, who conduct inspections, respond to emergency situations and to public health events on conveyances. The personal information may include name, home and work contact information, biographical information, educational information, employee identification number, employment status, emergency contact, qualifications, designation, immunization, and medical information.","Ce fichier banque décrit l'information associée aux qualifications et à la formation du personnel procédant aux inspections, et intervenant en cas d'urgences ou de problèmes de santé publique qui surviennent dans les transports. Les renseignements personnels peuvent inclure le nom, les coordonnées au domicile et au travail, les renseignements biographiques, les renseignements sur l'éducation, le numéro d'identification de l'employé, le statut d'emploi, la personne à appeler en cas d'urgence, les qualifications, le titre, l'immunisation et les données médicales.",Current and former Health Canada employees who perform inspections and respond to emergencies and other public health events.,Les employés actuels et passés de Santé Canada procédant à des inspections et intervenant en cas d'urgences et d'autres problèmes de santé publique.,Emergency Management responsibilities and the program records have been transferred from Health Canada to the Public Health Agency of Canada as of fiscal year 2013-2014.,Les responsabilités en matière de gestion des urgences et les fichiers du programme ont été transférés de Santé Canada à l'Agence de la santé publique du Canada à compter de l'exercice 2013-2014.,,,"The personal information is used to ensure that emergency response personnel have the necessary immunization, specialized training, personal medical and security clearance, necessary credentials and delegation of authority to respond to a given outbreak or other emergency situation. Personal information is collected pursuant to Department of Health Act and Quarantine Act.","Les renseignements personnels sont utilisés pour veiller à ce que le personnel d'intervention en cas d'urgence dispose de l'immunisation nécessaire, d'une formation spécialisée, d'un certificat de santé et d'une habilitation de sécurité et de la délégation de pouvoir nécessaires pour intervenir en cas d'épidémie ou de toute autre situation d'urgence. Les renseignements personnels sont recueillis conformément à la *Loi sur le ministère de la Santé* et à la *Loi sur la mise en quarantaine*.","The information may be used or disclosed for the following purposes: reporting to senior management, audit and evaluation, to establish an inventory of employees qualified to conduct inspections, and to respond to emergencies and public health events on conveyances. During emergency situations personal information may be shared with other federal institutions, provincial or territorial governments and with other branches within the Public Health Agency of Canada for response purposes.","Les renseignements peuvent être utilisés ou communiqués, aux fins suivantes : dans un rapport destiné à la haute direction, un audit ou une évaluation, pour dresser un inventaire des employés qualifiés pour mener des inspections, et pour intervenir en cas d'urgence ou de problèmes de santé publique survenant dans les transports. Dans les situations d'urgence, il se peut que les renseignements personnels soient transmis à d'autres institutions fédérales, aux gouvernements provinciaux ou territoriaux, ou à d'autres directions générales au sein de Santé Canada à des fins d'intervention.",Two years following the last administrative action.,Deux ans après la dernière action administrative.,2015/022,2015/022 **Renvoi à la catégorie de documents no :** ASPC 010 0024,PHAC 010 0024,,,,20170109,20170109
PHAC PPU 307,Canadian Accident Injury Reporting and Evaluation,Rapports et évaluation sur les blessures et accidents au Canada,PHAC PPU 307,ASPC PPU 307,"This bank includes the chart number, institution, age of victim, admittance date, number of days hospitalized, injury nature and cause, place of occurrence, disposition and product involved.","Ce fichier contient le numéro de dossier, le nom de l'établissement hospitalier, l'âge de la victime, la date d'admission, le nombre de journées d'hospitalisation, la nature et la cause de la blessure, le lieu de l'accident, et le produit concerné.",General public.,Grand public.,Emergency Management responsibilities and the program records have been transferred from Health Canada to the Public Health Agency of Canada as of fiscal year 2013-2014.,,,,The bank was established to assist in setting of priorities and is used for internal and external data retrievals and regular publications.,Ce fichier a été créé pour faciliter l'établissement des priorités. Il est utilisé pour la recherche de données internes et externes et pour des publications régulières.,None,Aucun,Two years following the last administrative action.,Deux ans après la dernière action administrative.,2015/022,2015/022 **Renvoi à la catégorie de documents no :** ASPC 010 0024,PHAC 010 0024,,,,20170107,20170107
PHAC PPU 310,International Health Regulations - Inter-jurisdictional Notifications,Règlement sanitaire international - Notifications inter-juridictionnelles,PHAC PPU 310,ASPC PPU 310,"This bank describes information related to the work that is completed by the Public Health Agency of Canada (PHAC) to help prevent, detect, and rapidly respond to public health threats. PHAC is designated as the International Health Regulations (IHR) National Focal Point (NFP) for Canada. PHAC facilitates coordination and collaboration of IHR implementation with provinces and territories and across the federal government, and acts as the hub for all IHR-related communication with the Pan American Health Organization (PAHO) / World Health Organization (WHO), and IHR NFPs in other countries. PHAC facilitates timely and relevant bilateral information sharing on public health events for the purpose of critical public health follow-up in accordance with the IHR and Canadian legislation including the *Department of Health Act*, the *Public Health Agency of Canada Act*, and the *Quarantine Act*. Inter-jurisdictional Notifications (IJNs) are communications between jurisdictions regarding specific cases and contacts of communicable diseases of public health concern. Information sharing under article 44 of the IHR (Collaboration and Assistance) are coordinated and actioned by IJN technical teams. An IJN occurs when there is an international component to the information sharing, for instance: * when another country informs PHAC of a Canadian who is exposed to, or is diagnosed with a communicable disease in another country; or * when a Canadian province/territory informs PHAC of a resident who was diagnosed with, or was exposed to, a communicable disease while travelling in another country, for which there may be public health actions indicated in that country, or who was communicable during transit. IJN teams routinely collect, use, disclose and dispose of personal information in the course of supporting the management of a public health event, and in situations where cases or contacts (those exposed) travelled internationally within a timeframe relevant to the management of a disease. This pertains to Canadians as well as citizens of other countries who are in Canada or recently travelled to Canada. The scope of this activity involves sharing information with public health authorities (provinces and territories, as well as other countries, and conveyance operators (i.e. airlines, etc.)) who can take appropriate public health actions (including quarantine, contact tracing, case follow up, etc.) with this information. Personal information collected may include name, contact information, citizenship status, country of residence, date of birth, gender, test result for the disease in question, date of symptom onset and assessment of symptoms, personal travel details, and passport number.","Ce fichier décrit l'information relative au travail accompli par l'Agence de la santé publique du Canada (ASPC) pour aider à prévenir et à détecter les menaces pour la santé publique et à y réagir rapidement. L'ASPC est désignée comme le point focal national (PFN) du Règlement sanitaire international (RSI) pour le Canada. L'ASPC facilite la coordination et la collaboration pour la mise en œuvre du RSI avec les provinces et les territoires ainsi qu'avec l'ensemble du gouvernement fédéral, et sert de plaque tournante pour toutes les communications liées au RSI avec l'Organisation panaméricaine de la santé (OPS), l'Organisation mondiale de la santé (OMS) et les PFN du RSI dans d'autres pays. L'ASPC facilite le partage d'informations bilatérales pertinentes et opportunes sur les événements de santé publique aux fins du suivi critique de la santé publique, conformément au RSI et à la législation canadienne, notamment la *Loi sur le ministère de la Santé*, la *Loi sur l'Agence de la santé publique du Canada* et la *Loi sur la quarantaine*. Les notifications inter-juridictionnelles (NIJ) sont des communications entre juridictions concernant des cas et des contacts spécifiques de maladies transmissibles présentant un intérêt pour la santé publique. Le partage d'informations en vertu de l'article 44 du RSI (Collaboration et assistance) est coordonné et mis en œuvre par les équipes techniques des NIJ. On parle de NJI lorsque le partage de l'information comporte une composante internationale, par exemple : * lorsqu'un autre pays informe l'ASPC qu'un Canadien a été exposé à une maladie transmissible dans un autre pays ou qu'on lui a diagnostiqué une telle maladie; ou * lorsqu'une province ou un territoire canadien informe l'ASPC d'un résident qui a reçu un diagnostic de maladie transmissible ou qui a été exposé à une telle maladie lors d'un voyage dans un autre pays, pour lequel des mesures de santé publique peuvent être indiquées dans ce pays, ou qui a été contaminé pendant son transit. Les équipes du NIJ recueillent, utilisent, divulguent et éliminent régulièrement des renseignements personnels dans le cadre de leur soutien à la gestion d'un événement de santé publique et dans les situations où des cas ou des contacts (personnes exposées) ont voyagé à l'étranger dans un délai pertinent pour la gestion d'une maladie. Cela concerne les Canadiens ainsi que les citoyens d'autres pays qui se trouvent au Canada ou qui ont récemment voyagé au Canada. La portée de cette activité implique le partage de l'information avec les autorités de santé publique (provinces et territoires, ainsi que d'autres pays, et les exploitants de moyens de transport (c.-à-d. les compagnies aériennes, etc.)) qui peuvent prendre les mesures de santé publique appropriées (y compris la mise en quarantaine, la recherche des contacts, le suivi des cas, etc.) avec cette information. Les informations personnelles recueillies peuvent inclure le nom, les coordonnées, le statut de citoyenneté, le pays de résidence, la date de naissance, le sexe, le résultat du test pour la maladie en question, la date d'apparition et d'évaluation des symptômes, les détails du voyage personnel et le numéro de passeport.",General public.,Grand public.,,,,,"The personal information is used to support Canada in meeting its obligations under the International Health Regulations (IHR) (2005) in order to inform other countries, provinces and territories, and conveyance operators of cases of, and exposure to, certain communicable diseases in an effort to minimize the spread of disease. This includes sharing information for contact tracing, public health management, following up on cases, and/or for situational awareness. Personal information is collected pursuant to section 3 of the *Public Health Agency of Canada Act* and section 4(1) and 4(2) of the *Department of Health Act*.","Les renseignements personnels sont utilisés pour aider le Canada à respecter ses obligations en vertu du Règlement sanitaire international (RSI) (2005) afin d'informer les autres pays, provinces et territoires, ainsi que les exploitants de moyens de transport, des cas de certaines maladies transmissibles et de l'exposition à celles-ci, dans le but de réduire au minimum la propagation des maladies. Cela comprend le partage d'informations pour la recherche de contacts, la gestion de la santé publique, le suivi des cas et/ou la connaissance de la situation. Les renseignements personnels sont recueillis en vertu de l'article 3 de la *Loi sur l'Agence de la santé publique du Canada* et des paragraphes 4(1) et 4(2) de la *Loi sur le ministère de la Santé*.","The information may be used or disclosed in the following circumstances: * when another country informs PHAC of a Canadian exposed to, or diagnosed with a certain communicable disease in another country; * when a Canadian province/territory informs PHAC of a resident who acquired or was exposed to COVID-19 while travelling in another country, for which there may be public health actions indicated in that country, or who was communicable during transit; or * to assist with controlling the ongoing spread of disease and to provide assistance to those that are or who may be infected, which is directly connected to the purpose for which the personal information was collected in order to minimize the spread of disease. Therefore, the personal information identified above can be disclosed to provincial partners and IHR National Focal Points through the IHR in accordance with paragraph 8(2)(a) of the Privacy Act as the purpose for disclosing the personal information is for the same purpose for which the personal information was collected.","Les renseignements peuvent être utilisés ou communiqués dans les circonstances suivantes : * lorsqu'un autre pays informe l'ASPC qu'un Canadien a été exposé à une certaine maladie transmissible dans un autre pays ou a reçu un diagnostic à cet égard; * lorsqu'une province ou un territoire canadien informe l'ASPC d'un résident qui a contracté ou a été exposé au COVID-19 lors d'un voyage dans un autre pays, pour lequel des mesures de santé publique peuvent être indiquées dans ce pays, ou qui a été contaminé pendant le transit; ou * pour aider à contrôler la propagation continue de la maladie et pour fournir de l'aide aux personnes qui sont ou qui pourraient être infectées, ce qui est directement lié à l'objectif pour lequel les renseignements personnels ont été recueillis afin de minimiser la propagation de la maladie. Par conséquent, les renseignements personnels susmentionnés peuvent être communiqués aux partenaires provinciaux et aux coordonnateurs nationaux du RSI par l'entremise du RSI, conformément à l'alinéa 8(2)a) de la *Loi sur la protection des renseignements personnels*, puisque le but de la divulgation des renseignements personnels est le même que celui pour lequel ils ont été recueillis. **Normes de conservation et d'élimination :** Deux ans après la dernière mesure administrative.",Two years following the last administrative action.,,2015/022,2015/022,PHAC 010 0046,ASPC 010 0046,,,20210079,20210079
