bank_number_key,title_en,title_fr,bank_number_en,bank_number_fr,description_en,description_fr,class_of_individuals_en,class_of_individuals_fr,note_en,note_fr,social_insurance_number_en,social_insurance_number_fr,purpose_en,purpose_fr,consistent_uses_en,consistent_uses_fr,retention_and_disposal_standards_en,retention_and_disposal_standards_fr,rda_number_en,rda_number_fr,related_record_number_en,related_record_number_fr,last_updated_en,last_updated_fr,tbs_registration_en,tbs_registration_fr
PHAC PPE 305,All Events Response Operations (AERO),Opérations d'intervention en toutes circonstances (OITC),PHAC PPE 305,ASPC PPE 305,"This bank describes information that is related to Health Portfolio employees who may be selected to respond to emergency situations and to public health events. The personal information may include name, work contact information, biographical information, educational information, work and emergency response experience, availability, security related questions and answers, passport status, employee personnel information, training information, language proficiencies, employment status, business emergency contact, qualifications, professional designations and signature.","Ce fichier décrit l'information relative aux employés du portefeuille de la Santé qui peuvent être sélectionnés pour intervenir en cas de situations d'urgence ou d'événements de santé publique. Les renseignements personnels peuvent comprendre le nom, les renseignements biographiques, les renseignements sur les études, les renseignements médicaux, l'expérience de travail et celle des interventions d'urgence, la disponibilité, les questions et réponses liées à la sûreté, le statut du passeport, les informations relatives au statut de l'employé, l'information sur la formation, les compétences linguistiques, la situation de l'emploi, la personne à joindre en cas d'urgence au travail, les qualifications, les titres professionnels et la signature.",Health Portfolio employees who apply to participate in public health response activities.,Employés du portefeuille de la Santé qui présentent une demande pour participer aux activités d'intervention en santé publique.,,,,,"The information is used to establish an inventory of employees for responding to emergencies and public health events, and to select individuals to participate in field mobilizations and work at the Public Health Agency of Canada emergency operations center. Information is collected pursuant to Section 3 of the Public Health Agency of Canada Act and section 4 of the Department of Health Act.",Les renseignements sont utilisés pour établir un inventaire des employés pour réagir aux urgences et aux événements de santé publique et sélectionner des personnes en vue de leur participation aux mobilisations de terrain et au travail du Centre des opérations d'urgence de l'Agence de la santé publique du Canada. Les renseignements sont recueillis en vertu de l'article 3 de la *Loi sur l'Agence de la santé publique du Canada* et de l'article 4 de la *Loi sur le ministère de la Santé*.,"The information may be accessed, used, or disclosed for the following purposes: audit or evaluation, reporting to senior management, statistical purposes, and shared with various internal program areas. Limited information regarding a person's deployment status may be shared with Global Affairs Canada Citizenship and Immigration Canada; refer to Consular Affairs - Assistance to Canadians DFATD PPU 010. Information may be shared with international organizations or institutions (e.g., World Health Organization, Global Outbreak Alert and Response Network, Pan American Health Organization, United Nations), provincial and territorial governments, municipal or regional government(s) or institution(s) to respond to mobilizations and requests for assistance.","Les renseignements peuvent être consultés, utilisés ou communiqués aux fins suivantes : vérification ou évaluation, présentation de rapports à la haute direction, statistiques et communication à différents secteurs de programme internes. Une quantité limitée de renseignements concernant le déploiement d'une personne peuvent être communiqués à Affaires mondiales Canada, à Citoyenneté et Immigration Canada (voir Affaires consulaires – aide aux Canadiens (MAECD PPU 010)). Les renseignements peuvent être communiqués à des organismes ou à des institutions internationales (par ex., l'Organisation mondiale de la santé, le Réseau mondial d'alerte et d'action en cas d'épidémie, l'Organisation panaméricaine de la santé ou les Nations Unies), aux gouvernements provinciaux et territoriaux ou aux administrations ou institutions municipales ou régionales en réponse à des mobilisations et à des demandes d'aide.",Two years following the last administrative action.,Deux ans après la dernière action administrative.,2015/022,"2015/022 **Renvoi aux catégories de documents no :** ASPC 010 0021, ASPC 010 0048","PHAC 010 0021, PHAC 010 0048",,,,20160012,20160012
PHAC PPU 288,Skills Enhancement,Amélioration des compétences,PHAC PPU 288,ASPC PPU 288,"This bank describes information that is related to registration information for The Skills Online program, a professional development program which provides continuing education through a set of facilitated and self-directed Internet-based modules to public health practitioners across Canada and internationally. Personal information may include name, contact information, biographical information, date of birth, education history, employee personnel information, courses already taken, signature, and personal passwords.","Ce fichier contient des renseignements liés aux informations d'enregistrement des praticiens de la santé publique au Canada et à l'international au programme de compétences en ligne, un programme de perfectionnement professionnel qui offre de la formation continue par le biais d'un ensemble de modules accessibles sur Internet et qui sont animés ou fondés sur l'auto-apprentissage. Les renseignements personnels peuvent inclure le nom, les coordonnées, des renseignements biographiques, la date de naissance, l'historique de l'éducation, des informations relatives au statut de l'employé, des cours déjà suivis, la signature et les mots de passe personnels.",Public Health Practitioners.,Les praticiens de santé publique.,,,,,Personal information is used to administer the public health workforce activity. Personal information is collected pursuant to Section 4 of the Department of Health Act.,Les renseignements personnels sont utilisés afin d'administrer les activités de la main d'œuvre de la santé publique. Cette information est recueillie conformément à l'article 4 de la *Loi sur le ministère de la Santé*.,"Information may be used or disclosed for the following purposes: reporting to senior management and safety. Information will be released to a third party administrator, who handles participants' registration and administers the modules on behalf of Public Health Agency of Canada. Information may be disclosed to provincial/territorial, federal government, public health agencies and organizations, and local organizations in the event of a public health crisis and subsequent human resource mobilization to respond to such crises. Information may also be used periodically to solicit participant feedback.","L'information peut être utilisée ou partagée pour les fins suivantes : rapports à la haute direction et sécurité. Les renseignements sont partagés avec un tiers administrateur, qui gère l'enregistrement des participants et administre les modules pour le compte de l'Agence de la santé publique du Canada. L'information peut être divulguée aux organismes gouvernementaux et à des organisations de santé publique des provinces / territoires et fédérales, ainsi qu'à des organisations locales dans l'éventualité d'une crise de santé publique et de la mobilisation des ressources humaines subséquentes permettant de répondre à de telles crises. L'information peut également être utilisée périodiquement pour solliciter les commentaires des participants.",Two years following the last administrative action.,Deux ans après la dernière action administrative.,2015/022,2015/022 **Renvoi à la catégorie de documents no :** ASPC 008 516,PHAC 008 516,,,,20110483,20110483
PHAC PPU 306,Biosecurity,Biosécurité,PHAC PPU 306,ASPC PPU 306,"This bank describes information that is related to individuals who are responsible for activities with human pathogens or toxins (e.g., producing, storing, permitting any person access, transferring, importing or exporting, releasing or otherwise abandoning, or disposing of a human pathogen or toxin) and who have registered with the Public Health Agency of Canada, Centre for Biosecurity. The personal information may include name, contact information and place of employment, safety training information, and a notice to the Minister of Health indicating that they are responsible for human pathogens or toxins, the risk groups to which the human pathogens belong, and where activities they are responsible for are conducted.","Ce fichier décrit l'information relative aux personnes qui sont responsables des activités touchant aux agents pathogènes humains ou aux toxines (par ex., production; stockage; autorisation d'y accéder accordée à toute personne; transfert; importation ou exportation; libération ou abandon ou élimination d'un agent pathogène humain ou d'une toxine) qui se sont inscrites auprès du Centre de la biosûreté de l'Agence de la santé publique du Canada. Les renseignements personnels peuvent comprendre le nom, les coordonnées et le lieu de travail, l'information sur la formation à la sécurité et un avis au ministre de la Santé qui indique qu'elles ont la responsabilité de s'occuper d'agents pathogènes humains ou de toxines, les groupes de risques auxquels les agents pathogènes humains appartiennent et l'endroit où les activités dont ils sont responsables sont réalisées.","Employees of government, academic, research, diagnostic, and medical institutions, and representatives of companies, corporations, and associations.","Employés du gouvernement, universitaires, établissements de recherche, de diagnostic et médicaux et représentants des entreprises, des sociétés et des associations.","On December 1, 2015, the *Human Pathogens Importation Regulations* (HPIR) were repealed. New applications are no longer being accepted under these regulations.","Le 1er décembre 2015, le *Règlement sur l'importation des agents anthropopathogènes* (RIAA) a été abrogé. Les nouvelles demandes ne sont plus acceptées sur le fondement de ce règlement.",,,The personal information is used to register individuals who are responsible for activities involving human pathogens or toxins. Personal information is collected pursuant to section 70 of the *Human Pathogens and Toxins Act* (HPTA).,Les renseignements personnels sont utilisés pour inscrire les personnes qui sont responsables d'activités qui font appel à des agents pathogènes humains ou à des toxines. Les renseignements personnels sont recueillis en vertu de l'article 70 de la *Loi sur les agents pathogènes humains et les toxines*.,"The information may be used, disclosed for the following purposes: enforcement, safety and security, and audit and evaluation. Personal information may be shared with the Canadian Food Inspection Agency (refer to CFIA PPU 096 Investigations: Violations of Acts and Regulations, CFIA PPU 097 Inspector/Grader Certificate & Application; CFIA PPU 011 Animal – Importation Program), the Canadian Border Services Agency, Public Safety Canada, Public Prosecution Service of Canada (refer to PPSC PPU 002 Prosecutions and Prosecution-related Activities), and Transport Canada for purposes related to the transportation of dangerous goods, Government(s) of foreign state(s) or (an) institution thereof, international organizations of state or (an) institution thereof, province(s) or (an) institution thereof; municipal or regional government(s) or (an) institution(s) thereof, if: the disclosure is necessary for the administration or enforcement of the Human Pathogens and Toxins Act or its regulations; the Minister of Health has reasonable grounds to believe that the disclosure is necessary to address a serious and imminent danger to the health or safety of the public; or the disclosure is necessary to enable Canada to fulfil its international obligations.","Les renseignements peuvent être utilisés ou communiqués aux fins suivantes : application de la loi, sûreté et sécurité, et audit et évaluation. Les renseignements personnels peuvent être communiqués à l'Agence canadienne d'inspection des aliments (voir ACIA PPU 096 Enquêtes : infractions aux lois et aux règlements; ACIA PPU 097 Certificat et demande de certificat de l'inspecteur/classificateur; ACIA PPU 011 Animaux – Programme d'importation), à l'Agence des services frontaliers du Canada, à Sécurité publique Canada, au Service des poursuites pénales du Canada (voir SPPC PPU 002 Poursuites et activités connexes) et à Transports Canada aux fins liés au transport des marchandises dangereuses; aux gouvernements d'États étrangers ou à l'une de leurs institutions; aux organisations internationales d'État ou à l'une de leurs institutions; aux provinces ou à l'une de leurs institutions; aux administrations municipales ou régionales ou à l'une de leurs institutions, si : la communication est nécessaire à l'administration ou à l'application de la *Loi sur les agents pathogènes humains et les toxines* ou de son règlement, et le ministre de la Santé a un motif raisonnable de croire que la communication est nécessaire pour remédier à un danger grave et imminent pour la santé ou la sécurité du public; ou la communication est nécessaire pour permettre au Canada de s'acquitter de ses obligations internationales.",Two years following the last administrative action.,Deux ans après la dernière action administrative.,2015/022,2015/022 **Renvoi à la catégorie de documents no :** ASPC 010 0047,PHAC 010 0047,,,,20150168,20150168
PHAC PPU 308,Human Pathogens and Toxins Act Security Clearance Program,Programme d'habilitation de sécurité en vertu de la *Loi sur les agents pathogènes humains et les toxines,PHAC PPU 308,ASPC PPU 308,"This bank describes information that is related to the Public Health Agency Canada's Human Pathogens and Toxins Act (HPTA) Security Clearance Program. Individuals are required to obtain an HPTA Security Clearance if they work with, or have access to, prescribed human pathogens and toxins, known as Security Sensitive Biological Agents (SSBAs), that if misused, can pose a risk to Canada's national security. The personal information may include name, contact information, biographical and biometric information, marital status, citizenship status, entry into Canada and visa information, credit information, criminal checks and history, educational, employment and travel history, date and place of birth and death, identification numbers, gender, preferred language, other Government of Canada issued security clearances, financial information, medical information, physical attributes, photographs, signature, consent, and any other information provided by the applicant for the purpose of making a determination under section 14 of the Human Pathogens and Toxins Regulations (HPTR).","Ce fichier décrit les renseignements liés au Programme d'habilitation de sécurité en vertu de la *Loi sur les agents pathogènes humains et les toxines* (LAPHT) de l'Agence de la santé publique du Canada. Les personnes sont tenues d'obtenir une habilitation de sécurité en vertu de la LAPHT si elles travaillent au contact de certains agents pathogènes humains et de certaines toxines, connus sous le nom d'agents biologiques à cote de sécurité élevée (ABCSE), qui, s'ils sont mal utilisés, peuvent représenter un risque pour la sécurité nationale du Canada ou si elles y ont accès. Les renseignements personnels peuvent comprendre le nom, les coordonnées, les renseignements biographiques et biométriques, l'état matrimonial, la citoyenneté, les renseignements relatifs à l'entrée au Canada et aux visas, les renseignements sur le crédit, les vérifications du casier judiciaire et des antécédents, les études, l'emploi et les antécédents de voyage, la date et le lieu de naissance et de décès, les numéros d'identification, le sexe, la langue préférée, les autres habilitations de sécurité délivrées par le gouvernement du Canada, les renseignements financiers, les renseignements médicaux, les caractéristiques physiques, les photos, la signature, le consentement, et tout autre renseignement fourni par le demandeur aux fins d'une détermination effectuée en vertu de l'article 14 du Règlement sur les agents pathogènes humains et les toxines (RAPHT).",The general public and HPTA security clearance applicants and their current and former partners.,Le public et les demandeurs d'une habilitation de sécurité en vertu de la LAPHT ainsi que leurs partenaires actuels et anciens.,,,,,"Personal information is used to support decisions to grant, refuse, suspend, revoke or appeal an HPTA Security Clearance. Personal information is collected pursuant to sections 33 to 35 of the Human Pathogens and Toxins Act and sections 11 to 22 of the Human Pathogens and Toxins","Les renseignements personnels servent à appuyer les décisions d'accorder, de refuser, de suspendre, de révoquer ou d'interjeter appel d'une habilitation de sécurité délivrée en vertu de la LAPHT. Les renseignements personnels sont recueillis en vertu des articles 33 à 35 de la *Loi sur les agents pathogènes humains et les toxines* et des articles 11 à 22 du Règlement sur les agents pathogènes humains et les toxines.","Personal information may be disclosed to the Royal Canadian Mounted Police to conduct criminal record checks (refer to RCMP OPS 1214) and the Canadian Security Intelligence Service to conduct a security assessment (refer to CSIS PPU 005). With consent, personal information may also be disclosed to credit reporting companies to conduct a credit check. In accordance with section 39(1) of the HPTA, personal information may also be disclosed for audit and evaluation purposes, the administration or enforcement of the HPTA or its regulations, to address a serious and imminent danger to the health or safety of the public and to meet international obligations.","Des renseignements personnels peuvent être communiqués à la Gendarmerie royale du Canada pour effectuer des vérifications de casier judiciaire (voir GRC OPS 1214) et au Service canadien du renseignement de sécurité pour mener une enquête de sécurité (voir SCRS PPU 005). Les renseignements personnels peuvent également être communiqués aux sociétés d'évaluation du crédit pour qu'elles effectuent une vérification du crédit si la personne visée y consent. Conformément à l'article 39(1) de la LAPHT, les renseignements personnels peuvent également être communiqués, aux fins d'audit et évaluation ou de l'administration ou de l'application de la LAPHT ou de ses règlements, afin de faire face à un danger grave et imminent pour la santé ou la sécurité du public et de satisfaire aux obligations internationales.",Five years following the last administrative action.,Cinq ans après la dernière action administrative.,2015/022,2015/022 **Renvoi à la catégorie de documents no :** ASPC 010 0047,PHAC 010 0047,,,,20180027,20180027
PHAC PPU 309,Human Pathogens and Toxins Act Licensing,Délivrance de permis en vertu de la *Loi sur les agents pathogènes humains et les toxines,PHAC PPU 309,ASPC PPU 309,"This bank describes information related to applications for licenses to conduct controlled activities involving human pathogens and toxins. The personal information collected may include name, license number, job title and employer, contact information, language preference, and signature.","Ce fichier décrit les renseignements relatifs aux demandes de permis pour mener des activités réglementées mettant en cause des agents pathogènes humains et des toxines. Les renseignements personnels recueillis peuvent comprendre le nom, le numéro de permis, le titre du poste et le nom de l'employeur, les coordonnées, la langue préférée et la signature.",Program applicants.,demandeurs du programme.,Pathogen and Toxin Licences issued under the HPTA replaces the former registration requirement under the Human Pathogens and Toxins Act (HPTA). Refer to PHAC PPU 306.,Le permis délivré en vertu de la *Loi sur les agents pathogènes humains et les toxines* remplace l'ancienne exigence d'enregistrement en vertu de la LAPHT. Voir ASPC PPU 306.,,,"The personal information is used to administer the HPTA Licensing Program, including granting, refusing, suspending, revoking, cancelling, varying or appealing license applications or licenses. Personal information is collected pursuant to sections 18, 20 and 21 of the Human Pathogens and Toxins Act and subsection 2(1) of the Human Pathogens and Toxins Regulations (HPTR).","Les renseignements personnels sont utilisés pour gérer le programme de délivrance de permis en vertu de la LAPHT, y compris l'octroi, le refus, la suspension, la révocation, l'annulation, la modification d'un permis ou l'appel relatif à une demande de permis ou à un permis. Les renseignements personnels sont recueillis en vertu des articles 18, 20 et 21 de la *Loi sur les agents pathogènes humains et les toxines* et du paragraphe 2(1) du Règlement sur les agents pathogènes humains et les toxines (RAPHT).","The information may be used or disclosed for compliance and enforcement of the HPTA and the HPTR, or for audit and evaluation purposes. Personal information may be disclosed to the Canadian Food Inspection Agency (CFIA) to verify the ongoing compliance of regulated facilities with a Pathogen and Toxin license issued under the Health of Animals Regulations (HAR) to import, transfer, or receive terrestrial animal pathogens (refer to CFIA PPU 096 Investigations: Violations of Acts and Regulations, CFIA PPU 097 Inspector/Grader Certificate & Application; CFIA PPU 011 Animal – Importation Program). In accordance with section 39(1) of the HPTA, personal information may also be disclosed to a department or agency of the government of Canada or a province, to a foreign government or to an international organization, for the administration or enforcement of HPTA or its regulations, to address a serious and imminent danger to the health or safety of the public and to meet international reporting obligations.","Les renseignements peuvent être utilisés ou communiqués aux fins de la conformité et de l'application de la LAPHT et du RAPHT, et aux fins d'audit et évaluation. Des renseignements personnels peuvent être communiqués à l'Agence canadienne d'inspection des aliments (ACIA) pour vérifier la conformité des installations réglementées à un permis relatif aux agents pathogènes et aux toxines délivré en vertu du Règlement sur la santé des animaux (RSA) pour importer, transférer ou recevoir des agents pathogènes d'animaux terrestres (voir ACIA PPU 096 Enquêtes : Infractions aux lois et aux règlements, ACIA PPU 097 Certificat et demande de l'inspecteur/classificateur; ACIA PPU 011 Animaux – Programme d'importation). Conformément à l'article 39(1) de la LAPHT, les renseignements personnels peuvent également être communiqués à un ministère ou à un organisme du gouvernement du Canada ou d'une province, à un gouvernement étranger ou à une organisation internationale, aux fins de l'administration ou de l'application de la LAPHT ou de ses règlements, afin de faire face à un danger grave et imminent pour la santé ou la sécurité du public et de satisfaire aux obligations internationales de déclaration.",Two years following the last administrative action.,Deux ans après la dernière action administrative.,2015/022,2015/022 **Renvoi à la catégorie de document no :** ASPC 010 0047,PHAC 010 0047,,,,20180028,20180028
