bank_number_key,title_en,title_fr,bank_number_en,bank_number_fr,description_en,description_fr,class_of_individuals_en,class_of_individuals_fr,note_en,note_fr,social_insurance_number_en,social_insurance_number_fr,purpose_en,purpose_fr,consistent_uses_en,consistent_uses_fr,retention_and_disposal_standards_en,retention_and_disposal_standards_fr,rda_number_en,rda_number_fr,related_record_number_en,related_record_number_fr,last_updated_en,last_updated_fr,tbs_registration_en,tbs_registration_fr
PSC PPU 015,"Applicant Profiles, Applications and Referrals","Profils de candidat, candidatures et présentations de candidature",PSC PPU 015,CFP PPU 015,"This bank contains information about individuals who have created an applicant account in the Public Service Resourcing System (PSRS). To create a PSRS applicant account, an individual must provide required information, which will be retained in the individual's account profile and may be retained as part of submitted and in progress applications compiled within PSRS. Personal information required to create a PSRS applicant account includes name, contact information, citizenship status and partial date of birth. Additional personal information required to submit an application will be retained in the individual’s account profile and may be retained as part of submitted and in progress applications compiled within PSRS. The additional personal information required to submit an application may include Canadian Armed Forces service number and eligibility for the preference to veterans, Priority Reference Number and priority entitlement type, Nunavut Land Claims Agreement beneficiary information, employment status, work history and educational information, name and contact information of references, employee identification numbers, language, medical information and employment equity information. The individual can provide information on gender on a voluntary basis; this information is retained in the account profile for statistical analysis and reporting. PSRS also contains electronic screening information and may include manual screening information for each application the individual submitted to an advertised process. PSRS also captures applicant information for internal jobs and notifications, jobs open to the public, and the following recruitment programs: Post-Secondary Recruitment (formerly PSC PPU 096), Federal Student Work Experience Program (formerly PSC PPU 086), Recruitment of Policy Leaders and Research Affiliate Program. Assessment and referral information may also be contained in this bank, as well as individual test results (for unsupervised Internet tests, occupational tests or second language evaluation tests) (PSC PPU 025).","Ce fichier contient des renseignements concernant les personnes qui ont créé un compte de candidat dans le système de ressourcement de la fonction publique (SRFP). Pour créer un compte de candidat du SRFP, une personne doit fournir les renseignements requis, qui sont conservés dans le profil du compte de la personne et qui peuvent être stockés dans le SRFP (candidatures soumises et en progrès). Les renseignements personnels requis pour créer un compte de candidat du SRFP comprennent le nom, les coordonnées, la citoyenneté et la date de naissance partielle. Les renseignements personnels supplémentaires requis pour soumettre une candidature sont conservés dans le profil du compte de la personne et peuvent être stockés dans le SRFP (candidatures soumises et en progrès). Les renseignements personnels supplémentaires requis pour soumettre une candidature peuvent comprendre le numéro matricule des Forces armées canadiennes et l’éligibilité à la préférence aux anciens combattants, le numéro séquentiel de priorité et le type du droit de priorité, les renseignements sur les bénéficiaires de l’Accord sur les revendications territoriales du Nunavut, les renseignements sur les études, l’historique d’emploi et la situation professionnelle, nom et coordonnées des références, les numéros d’identification de l’employé, la langue, les renseignements médicaux ainsi que les renseignements sur l’équité en matière d’emploi. La personne peut fournir des renseignements sur le sexe sur une base facultative; ces renseignements sont conservés dans le profil du compte à des fins d’analyse et de rapports statistiques. Le SRFP contient également des renseignements de présélection électronique et il peut comprendre des renseignements de présélection manuelle pour chaque candidature soumise par la personne à un processus annoncé. Le SRFP saisit aussi les renseignements du candidat pour les annonces d’emplois et les notifications de dotation internes, les emplois ouverts au public ainsi que les programmes de recrutement suivants : Programme de recrutement postsecondaire (anciennement CFP PPU 096), Programme fédéral d’expérience de travail étudiant (anciennement CFP PPU 086), Programme de recrutement de leaders en politiques et Programme des adjoints de recherche. Les renseignements sur l’évaluation et les présentations de candidatures peuvent également être contenus dans ce fichier, de même que les résultats d’examens individuels (examens en ligne non supervisés, examens professionnels ou évaluations de langue seconde) (CFP PPU 025).","General public (non–public servants), federal employees (public servants) or any individual who has an applicant account in PSRS wishing to apply to the public service.","Le grand public (non-fonctionnaires), les employés fédéraux (fonctionnaires) ou toute personne ayant un compte de candidat dans le SRFP qui désire postuler un emploi à la fonction publique.","Individuals seeking access to this information are required to provide their PSRS applicant account number or username (email address), name and partial date of birth. If the individual is enquiring about a specific advertised process or notification, they must include the reference number or some identifying information with regard to the process.","Les personnes qui veulent avoir accès à ces renseignements doivent fournir leurs numéros de compte de candidat du SRFP ou leur nom d’utilisateur (adresse courriel), nom et date de naissance partielle. Si la personne demande des renseignements au sujet d’un processus annoncé précis ou d’une notification de dotation interne, elle doit inclure le numéro de référence ou certains renseignements déterminants concernant le processus. **Normes de conservation et d’élimination :** La pratique actuelle de conservation des dossiers dans le SRFP satisfait aux exigences minimales du Règlement sur la protection des renseignements personnels, à savoir une période de deux ans suivant la prise de la dernière mesure administrative. La CFP établit actuellement des normes de conservation et d’élimination pour le SRFP qui devraient être définies au cours de l’exercice financier 2016 2017. La mise en œuvre des moyens technologiques qui en permettront l’application aura lieu à une date ultérieure.",,,"This bank exists in accordance with sections 11, 30 and 36 of the PSEA, as well as sections 5 and 9 of the Employment Equity Act and article 23 of the Nunavut Land Claims Agreement. The personal information provided by the individual will be used by the PSC, the Office of the Chief Human Officer (OCHRO), Treasury Board Secretariat (TBS) and federal government organizations to identify applicants suitable for referrals and appointments to positions within the public service.","Ce fichier existe conformément aux articles 11, 30 et 36 de la Loi sur l’emploi dans la fonction publique et aux articles 5 et 9 de la Loi sur l’équité en matière d’emploi et au chapitre 23 de l’Accord sur les revendications territoriales du Nunavut. Les renseignements personnels fournis par la personne seront utilisés par la CFP, le Bureau du dirigeant principal des ressources humaines (BDPRH), le Secrétariat du Conseil du Trésor (SCT) et les organisations du gouvernement fédéral afin d’identifier les candidats qui conviennent aux présentations de candidature et nominations à des postes (autres que le groupe de direction) au sein de la fonction publique.","This bank is used to collect applicant data, to search for and identify applicants suitable for referrals and to hold individual’s applicant accounts and their profiles. The bank is also used to retain the individual’s applications that are in progress of being submitted and those applications that are submitted to internal and external advertised processes using PSRS. Searches of PSRS identify applicants suitable for referral and appointments to positions in the public service and, for certain programs, record referral information that is shared with government organizations. Employment equity information may be used for employment equity–related recruitment, HR management and statistical purposes by the PSC, the OCHRO, TBS and the employing organization or agency. It is also provided to the following systems: Analytical Environment (PSC PCE 761) and Employment Equity Data Base (TBS PCE 739). Other than for recruitment, the information on Nunavut Land Claims Agreement beneficiaries may be used for analytical purposes and shared with Employment and Social Development Canada for reporting on the Inuit Labour Force Analysis. The information may be collected, retained, used or disclosed for non-administrative purposes by PSC program activities in accordance with the authority under the PSEA for the following purposes: studies; evaluations; analytical activities; audits; research; reporting; surveys; and statistical analysis. The information may be disclosed to the PSC Investigations Directorate (PSC PPU 010) in accordance with section 8(2) of the Privacy Act and the authority under the PSEA.","Ce fichier est utilisé pour recueillir des données sur le candidat, rechercher et identifier des candidats qui conviennent aux présentations de candidatures et avoir accès au compte et profil de candidat de la personne. Le fichier sert aussi à conserver les candidatures en cours de soumission et demandes soumises dans le cadre de processus annoncés internes et externes au moyen du SRFP. Les recherches dans le SRFP permettent de cibler les candidats qui conviennent pour une présentation de candidature et nomination à des postes au sein de la fonction publique; dans le cas de certains programmes, les renseignements sur les présentations de candidature sont communiqués aux ministères. Les renseignements sur l’équité en matière d’emploi peuvent être utilisés pour le recrutement lié à l’équité en matière d’emploi, la gestion des ressources humaines ainsi qu’à des fins statistiques par la CFP, le BDPRH, le SCT et l’organisme employeur. Ils sont ensuite transmis aux systèmes suivants : Environnement analytique (CFP PCE 761) et base de données sur l’équité en matière d’emploi (SCT PCE 739). Les renseignements sur les bénéficiaires de l’Accord sur les revendications territoriales du Nunavut peuvent servir non seulement au recrutement, mais aussi à des fins d’analyse. Ils peuvent en outre être communiqués à Emploi et Développement social Canada pour la production de rapports sur l’analyse de la main-d’œuvre inuit. Les renseignements peuvent être recueillis, conservés, utilisés ou divulgués à des fins non administratives pour les activités de programme suivantes de la CFP, qui sont autorisées par la LEFP : études, évaluations, activités d’analyse, vérifications, recherches, production de rapports, sondages et analyses statistiques. Les renseignements peuvent être divulgués à la Direction des enquêtes de la CFP (CFP PPU 010) conformément au paragraphe 8(2) de la Loi sur la protection des renseignements personnels et à la LEFP.","The current retention practice of records in PSRS meets the minimum requirements of the Privacy Regulations, which is 2 years following the last administrative action. The PSC is currently developing retention and disposal standards for PSRS, which are expected to be defined within fiscal year 2016-17. Implementation of the technological mechanisms to enable them will occur at a later date.",,Under development,En cours d’élaboration **Numéro de la catégorie de documents pertinents :** CFP 1.2.1 – 4700 **Numéro d’enregistrement (SCT) :** 001422,PSC 1.2.1 - 4700,,,,001422,
PSC PPU 040,Personnel Selection,Sélection du personnel,PSC PPU 040,CFP PPU 040,"This bank may contain requests for candidate referral statements of merit criteria and conditions of employment, official languages profiles, selection process notices, applications, curricula vitae, rating guides, board reports, and all other documents used in establishing candidate merit, results and notification of appointment.","Ce fichier peut comprendre des demandes de présentations de candidats, énoncés des critères de mérite et conditions d’emploi, renseignements sur les profils de langues officielles, avis relatifs aux processus de sélection, formulaires de demande, curriculum vitae, guides de cotation, rapports de comité d’évaluation, documents utilisés pour évaluer le mérite des candidats, résultats et notifications de nomination.",Non-public servants and public servants who are being considered for appointment through a collective advertised appointment process by the Services and Business Development Sector.,Fonctionnaires et non-fonctionnaires dont la candidature est prise en considération pour une nomination dans le cadre d’un processus commun d’une nomination annoncée par la Secteur des services et du développement des affaires.,Persons completing a Personal Information Request Form are required to give the pertinent appointment process numbers.,Les personnes remplissant un formulaire de demande de renseignements personnels doivent fournir le bon numéro de processus de nomination.,,,"This bank exists in accordance with section 11 of the Public Service Employment Act to record and provide information related to any process of personnel selection, advertised or non-advertised, administered by the PSC.","Ce fichier a été créé conformément à l’article 11 de la LEFP dans le but de consigner et de fournir des renseignements liés à tous les processus de sélection du personnel, annoncés ou non, qui sont administrés par la CFP.","This bank is used to staff position. In the event of suspected irregularities in staffing or recruitment processes, information may be shared with the Investigations Directorate (PSC PPU 010). The information on employment equity groups is used for statistical purposes by the PSC, TBS and the employing department or agency. Information in this bank may be obtained from systems pertaining to applicant inventories and assessment results.","Ce fichier sert à la dotation de postes. En cas d’irrégularités soupçonnées dans les processus de dotation ou de recrutement, les renseignements peuvent être diffusés à la Direction des enquêtes (CFP PPU 010). Les renseignements sur les groupes désignés au titre de l’équité en emploi sont utilisés à des fins statistiques par la CFP, le SCT et les ministères ou organismes employeurs. Les renseignements contenus dans ce fichier peuvent provenir des systèmes liés aux répertoires de candidats et aux résultats d’évaluations. **Normes de conservation et d’élimination :** Les dossiers sont conservés pour une période de cinq ans après la dernière action administrative et sont ensuite détruits.","Records are retained for five years after the last administrative action, and then destroyed.",,2001/025,2001/025,PSC 1.2.1 – 4700,CFP 1.2.1 – 4700 **Numéro d’enregistrement (SCT) :** 001427,,,001427,
PSC PCU 202,Assessment Accommodation for Individuals with Special Needs,Mesures d’adaptation en matière d’évaluation pour les personnes ayant des besoins particuliers,PSC PCU 202,CFP PCU 202,"This bank contains information concerning accommodation requests related to testing or other forms of assessment, including second language evaluation or other HR management activities. Personal information may include name, contact information, biographical information, employment equity information, employee identification number, language, medical information, physical attributes, date of birth and the individual’s signature.","Ce fichier comprend des renseignements sur les demandes de mesures d’adaptation liées aux examens et à d’autres formes d’évaluation, dont celle de langue seconde ou d’autres activités de gestion des ressources humaines. Les renseignements personnels peuvent inclure le nom, les coordonnées, les renseignements biographiques, les renseignements sur l’équité en matière d’emploi, le numéro d’identification personnel, la langue, les renseignements médicaux, les traits physiques, la date de naissance et la signature de la personne.","General public and federal government employees who participate in PSC testing, assessments or other HR management activities and who request assessment accommodation.","Le grand public et les employés du gouvernement fédéral qui participent à des examens, à des évaluations ou à d’autres activités de gestion des ressources humaines de la CFP et les personnes qui demandent des mesures d’adaptation en matière d’évaluation.","In addition to the requirements specified on the TBS Personal Information request form, if applicable, individuals requesting information contained in this bank must provide the selection process number and the subject and date of correspondence.","Outre les renseignements indiqués sur le formulaire de demande d’accès à des renseignements personnels du SCT s’il y a lieu, les personnes demandant des renseignements contenus dans ce fichier doivent fournir le numéro de processus de sélection ainsi que l’objet et la date de la pièce de correspondance.",,,"Personal information is used to determine appropriate assessment accommodation and is collected under the authority of sections 11, 30 and 36 of the PSEA and sections 7 and 10 and subsection 15(2) of the Canadian Human Rights Act.","Les renseignements personnels sont utilisés pour déterminer les mesures d’adaptation en matière d’évaluation qui sont appropriées, et ils sont recueillis en vertu des articles 11, 30 et 36 de la LEFP et des articles 7 et 10, et du paragraphe 15(2) de la Loi canadienne sur les droits de la personne.","With the written consent of the individual seeking accommodation, PSC staff may ask to contact medical or other specialists directly for clarification on matters pertaining to assessment accommodation. The information may also be used or disclosed for the purposes of archiving, enforcement and safety. With the consent of the individual, information may be shared with the federal institution that is running the selection or appointment process for which the candidate requested accommodation. Information in the bank may, with the individual’s consent, also be aggregated with that of other candidates and used for research, training, evaluation or statistical purposes. Information in the bank may also be used for quality control purposes to validate test content and to monitor test performance. The information may be collected, retained, used or disclosed for non-administrative purposes by PSC program activities in accordance with the authority under the Public Service Employment Act for the following purposes: Studies, evaluations, analytical activities, audits; research, reporting, surveys and statistical analysis.","Avec le consentement écrit de la personne demandant des mesures d’adaptation, le personnel de la CFP peut demander à communiquer directement avec des spécialistes médicaux ou autres pour obtenir des éclaircissements sur des questions relatives aux demandes de mesures d’adaptation. Les renseignements peuvent également être utilisés ou divulgués pour des raisons d’archivage, d’exécution de la loi et de sécurité. Avec le consentement de la personne, les renseignements peuvent être communiqués à l’institution fédérale effectuant la sélection ou le processus de nomination pour lequel le candidat a demandé des mesures d’adaptation. De plus, les renseignements contenus dans le fichier peuvent, avec le consentement de la personne, être regroupés à ceux d’autres candidats et utilisés aux fins de recherche, formation, évaluation et statistique. L’information dans la banque de données peut aussi être utilisée pour l’assurance de la qualité afin de valider le contenu de test et pour la surveillance de la performance du test. Les renseignements peuvent être recueillis, conservés, utilisés ou divulgués à des fins non administratives pour les activités de programme suivantes de la CFP, qui sont autorisées par la LEFP : études, évaluations, activités d’analyse, vérifications, recherches, production de rapports, sondages et analyses statistiques. **Normes de conservation et d’élimination :** Tous les dossiers en papier sont conservés pendant dix ans après avoir été déclarés inactifs et ils sont ensuite détruits.","Hard-copy records are retained for 10 years after being declared inactive, and then destroyed.",,2015/??,2015/ ??? **Numéro de la catégorie de documents pertinents :** CFP 1.2.2 – 4900 **Numéro d’enregistrement (SCT) :** 20110275,PSC 1.2.2 - 4900,,,,20110275,
