bank_number_key,title_en,title_fr,bank_number_en,bank_number_fr,description_en,description_fr,class_of_individuals_en,class_of_individuals_fr,note_en,note_fr,social_insurance_number_en,social_insurance_number_fr,purpose_en,purpose_fr,consistent_uses_en,consistent_uses_fr,retention_and_disposal_standards_en,retention_and_disposal_standards_fr,rda_number_en,rda_number_fr,related_record_number_en,related_record_number_fr,last_updated_en,last_updated_fr,tbs_registration_en,tbs_registration_fr
PSC PCE 761,Analytical Environment,Environnement analytique,PSC PCE 761,CFP PCE 761,"The Analytical Environment includes information obtained from the following sources: Job-Based Analytical Information System (JAIS) which is derived from the Incumbent and Mobility files provided by the Office of the Chief Human Resources Officer (OCHRO) and is used to provide information on public servants occupying jobs in the public service and to estimate appointment activities; Employment Equity (EE) data extracts provided by OCHRO and is derived from the Treasury Board of Canada Secretariat (TBS) Employment Equity Data Bank (EEDB) (TBS PCE 739) is used for statistical purposes. The Survey of Staffing (SOS) data collection which is administered every two years in partnership with Statistics Canada and provides both quantitative and qualitative (non-personal) data, including perceptions of staffing and awareness of the legal rights and responsibilities regarding political activities among public service employees; Quarterly Appointment Process Reports (historical records only) with information on advertised and non-advertised appointments; data extracts from the Priority Information Management System (PIMS) which lists priority persons in an inventory searched by departments conducting staffing or recruitment; data extracts from the Public Service Resourcing System (PSRS) which provides information on applicants and applications to advertised appointment processes; and Publiservice data on internal staffing processes which provide information related to staffing advertisements and notifications pertaining to positions available to public servants (historical records only). The data holdings are maintained by the Public Service Commission (PSC) and contain basic personal information such as client service numbers (CSNs - a PSC generated identifier), work history, employment status, language proficiency, employment equity designated group, reasons for separation, education level, major field of study, and specific information related to an advertised process from the PSRS. The PSC also receives monthly extracts from the Public Works and Government Services Canada (PWGSC) Central Index File (PCU 715) which includes the Social Insurance Number. This information does not form part of the Analytical Environment but is used to create randomized CSNs. This data and information is used for the preparation of the PSC’s Annual Report, the production of statistical and organizational data reports, responding to requests from clients, for human resources (HR) planning and analysis, for release in the PSC Staffing Dashboard, for the oversight of the staffing system, for the preparation of PSC research and studies. Information from the incumbent/mobility systems of TBS is also used to update the JAIS. Statistical information from the Analytical Environment is also used to support the PSC’s audit functions (see Institution-specific PIB Audit PSC PPU 080). All publications and the PSC Staffing Dashboard are accessible via the PSC extranet.","L’environnement analytique comprend des données provenant des sources suivantes : le Système d’information analytique sur les emplois (SIAE), lequel est alimenté par les fichiers sur les titulaires et la mobilité fournis par le Bureau du dirigeant principal des ressources humaines (BDPRH), qui fournit des renseignements sur les fonctionnaires occupant des postes à la fonction publique et est utilisé pour l’évaluation des activités de nomination; les extraits de données sur l’équité en matière d’emploi fournis par BDPRH et dérivés de la banque de données sur l’équité en matière d’emploi (BDEE) du Secrétariat du Conseil du Trésor du Canada (SCT PCE 739) sont utilisés à des fins statistiques. Le sondage sur la dotation, pour lequel la collecte de données est effectuée tous les deux ans en partenariat avec Statistique Canada, fournit des données à la fois quantitatives et qualitatives (non personnelles) y compris la perception relative à la dotation et la sensibilisation des employés de la fonction publique quant à leurs droits et leurs responsabilités légales en matière d’activités politiques; les rapports trimestriels sur le processus de nomination (seulement les dossiers historiques), qui fournissent des renseignements sur les nominations issues de processus annoncés ou non annoncés; le Système de gestion de l’information sur les priorités (SGIP), qui transmet le nom des bénéficiaires de priorité dans un inventaire que les ministères consultent en période de recrutement ou de dotation; le Système de ressourcement de la fonction publique (SRFP), qui fournit des renseignements sur les postulants et les candidatures dans le cadre de processus de nomination annoncés; et Publiservice, qui fournit des renseignements sur les annonces et les notifications de dotation se rapportant à des postes offerts aux fonctionnaires dans le cadre de processus internes (seulement les dossiers historiques). Les fonds de données sont tenus à jour par la Commission de la fonction publique (CFP) et contiennent des renseignements personnels de base, comme le numéro de service à la clientèle (NSC, un numéro d’identification créé par la CFP), l’historique d’emploi, le statut d’emploi, la maîtrise des langues officielles, l’appartenance à un groupe désigné au titre de l’équité en matière d’emploi, le motif de cessation d’emploi, le niveau d’études, le principal domaine d’études et des données du SRFP relatives à des processus annoncés. La CFP reçoit aussi tous les mois des données extraites du fichier central de Travaux publics et Services gouvernementaux Canada (TPSGC) (PCU 715), y compris des numéros d’assurance social (NAS). Ces données ne se retrouvent pas dans le fichier sur l’environnement analytique, mais servent à créer des NSC aléatoirement. Ces renseignements sont utilisés pour la préparation du rapport annuel de la CFP, la production de rapports statistiques et organisationnels, les réponses aux demandes des clients, la planification et l’analyse des ressources humaines, le Tableau de bord de la dotation de la CFP, la surveillance du système de dotation, la réalisation de recherches et d’études menées par la CFP. Par ailleurs, les renseignements des systèmes sur les titulaires et la mobilité du SCT sont utilisés pour mettre à jour le SIAE. Les données statistiques du fichier sur l’environnement analytique sont utilisées à la CFP aux fins de vérification (voir le FRP de la CFP – Vérifications, CFP PPU 080). Toutes les publications et le Tableau de bord de la dotation de la CFP sont accessibles par l’intermédiaire de l’extranet de la CFP.",All individuals who have applied to or have been appointed to positions in the public service or who have left the public service.,Toutes les personnes qui ont posé leur candidature ou ont été nommées à des postes dans la fonction publique ou qui ont quitté la fonction publique.,,,,,"Pursuant to Section 11 of the Public Service Employment Act (PSEA), this Analytical Environment was created to record information on appointments in the public service (prior to April 1999), separations, and the distribution of public servants by department or agency and by location, and to provide information on the health of the staffing system of the public service. Staffing activities are estimated based on the JAIS. The Analytical Environment is updated on a regular basis.","Conformément à l’article 11 de la Loi sur l’emploi dans la fonction publique, ce fichier sur l’environnement analytique a été créé pour consigner des renseignements sur les nominations dans la fonction publique (avant avril 1999), les départs, et la répartition des fonctionnaires par ministère, organisme et lieu, et pour produire des données sur l’intégrité du système de dotation de la fonction publique. Les activités de dotation sont évaluées en fonction des données issues du Système d’information analytique sur les emplois (SIAE). Le fichier sur l’environnement analytique est mis à jour régulièrement.","The data and information are used for the preparation of reports to the Office of the Chief Human Resources Officer (OCHRO) on the utilization of HR and on the status of programs. This data and information are also used to track employee mobility and to determine the number of students who become regular employees of the public service and for other statistical purposes. Source data from TBS’ incumbent (TBS PCE 753) and mobility systems (TBS PCE 769) is used to provide some additional tombstone information for PSC employee inventories. In the event of suspected irregularities in staffing or recruitment processes, personal information such as personal work history, may be shared with the Investigations Directorate to validate other direct sources of information, as well as to follow up on conditions of corrective actions (see PSC PIB Investigations, Mediation and Conciliation, PSC PPU 010).","Ces données sont utilisées pour la rédaction de rapports pour le Bureau du dirigeant principal des ressources humaines (BDPRH) sur l’utilisation des ressources humaines et le statut des programmes. Elles servent notamment à suivre la mobilité des employés et à déterminer le nombre d’étudiants qui sont devenus des employés permanents de la fonction publique, ainsi qu’à d’autres fins statistiques. Les données sources des systèmes sur les titulaires (SCT PCE 753) et la mobilité (SCT PCE 769) du BDPRH fournissent aussi des renseignements de base supplémentaires pour les inventaires d’employés de la CFP. En cas d’irrégularités soupçonnées dans les processus de dotation ou de recrutement, les renseignements personnels, tel que le registre d’emploi dans la fonction publique, peuvent être communiqués à la Direction des enquêtes de la CFP pour valider d’autres sources de renseignements directes, en plus de faire le suivi des conditions des mesures correctives (voir le FRP de la CFP – Enquêtes, médiation et conciliation, CFP PPU 010). **Normes de conservation et d’élimination :** Système de gestion de l’information sur les nominations : Les données informatisées sont conservées dans des archives optiques pour une période indéterminée. Départs : Les données informatisées sont conservées jusqu’à ce qu’elles soient remplacées, puis elles sont supprimées, à l’exception des données de fin d’exercice, qui sont conservées dans des archives optiques pour une période indéterminée. Système de production de rapports sur le réaménagement des effectifs : Les dossiers sont conservés indéfiniment dans des archives optiques. Fichier statistique trimestriel (assimilé au fichier sur l’environnement analytique de 1995-1996 et supprimé en 2010–2011) : Les renseignements personnels sont conservés indéfiniment dans des archives optiques. Programme d’emploi pour les étudiants : Les renseignements sont stockés dans des archives optiques pour une période indéterminée. Le SIAE (incluant des NSCs) : Les renseignements personnels sont conservés indéfiniment. Les extraits de données de l’équité en matière d’emploi : sont stockés indéfiniment. Les extraits de données du SRFP : sont stockés indéfiniment. Les extraits de données du SGIP : sont stockés indéfiniment. Les renseignements du Sondage sur la dotation : sont stockés indéfiniment. Les extraits de données de Publiservice : sont stockés indéfiniment.","Appointment Information Management System: The computerized data is kept in a secure optical archive for an indefinite period. Separations: The computerized information is retained until it has been superseded and then it is deleted, except for year-end information which is kept in an optical archive indefinitely. Work Force Adjustment Reporting System: Retained indefinitely in an optical archive. Quarterly Statistical File (subsumed into the analytical environment from 1995-1996 and terminated in 2010-2011): Information on individuals is retained indefinitely in an optical archive. Student Employment Program: An optical archive is retained indefinitely. JAIS (including CSNs): Information on individuals is retained indefinitely. EE data extracts: Retained indefinitely. PSRS data extracts: Retained indefinitely. PIMS data extracts: Retained indefinitely. SOS data: Retained indefinitely. PubliService data extracts: Retained indefinitely.",,"85/016, 94/00, 90/012 and 92/016","85/016, 94/00, 90/012 et 92/016",PSC 1.3.2 – 8450,CFP 1.3.2 – 8450,,,002299,002299
PSC PCE 708,Appeal Hearings Personal Information Bank,Audiences d’appel,PSC PCE 708,CFP PCE 708,This bank contains Appeal Board decisions that are kept on CD-ROM. Persons completing a Personal Information Request Form are required to quote the Investigations Directorate file reference number given on the Appeal Board decision report submitted to the appellant.,Ce fichier contient des décisions de comité d’appel qui sont conservées sur CD-ROM. Les personnes qui remplissent une formule de demande d’accès à des renseignements personnels doivent fournir le numéro de dossier de la Direction des enquêtes qui est indiqué sur la décision du comité d’appel envoyée à l’appelant.,"Public servants who have filed an appeal, or public servants involved in the appeal.",Fonctionnaires qui avaient interjeté un appel ou qui étaient concernés par un appel.,,,,,This bank exists by reason of section 21 of the former PSEA and sections 19 to 28 of the former PSER to record and provide information on appeals.,Ce fichier existe en vertu de l’article 21 de l’ancienne LEFP et des articles 19 à 28 de l’ancien REFP. Il vise à consigner et à fournir des renseignements sur les appels.,Personal information may be routinely used or disclosed by PSC program activities in accordance with subsection 8(2) of the Privacy Act for the following activities: studies; evaluations; analytical activities; audits; research; reporting; and statistical analysis.,"En vertu du paragraphe 8(2) de la Loi sur la protection des renseignements personnels, les renseignements personnels peuvent être utilisés ou communiqués régulièrement pour les activités de programme suivantes de la CFP : Études, évaluations, activités d’analyse, vérifications, recherches, production de rapports et analyses statistiques. **Normes de conservation et d’élimination :** Les décisions sont conservées sur CD-ROM pendant 20 ans à compter de la date de la décision.",Decisions are retained on CD-ROM for 20 years from the date of the decision.,,2001/025,2001/025,PSC 1.3.3 – 8265,CFP 1.3.3 – 8265,,,001445,001445
PSC PPU 010,Investigations,Enquêtes,PSC PPU 010,PSC PPU 010,"As part of its mandate, the Public Service Commission (PSC) investigates allegations relating to appointment processes (public servants and members of the public) as well as instances of improper political activities. These include allegations of political influence and fraud as well as errors, omissions, or improper conduct. They also include errors, omissions or improper conduct resulting from [biases or barriers that disadvantage persons who belong to any equity-seeking group](/en/public-service-commission/services/public-service-staffing/definitions-biases-barriers-disadvantage-equity-seeking-group.html). Investigations are conducted by the PSC’s Investigations Directorate, pursuant to the *Public Service Employment Act (*PSEA). Investigations under the PSEA involve the collection, use, disclosure and retention of personal information. This information may include information about individuals requesting an investigation, individuals whose actions are subject to an investigation and other involved individuals, such as: name and contact information; personal record identifier or other identifiers, date of birth, medical and accommodation information, information related to equity-seeking group status, information relating to employment, allegations, submissions, testimonials, other information deemed relevant and necessary for the purposes of an investigation, and information on current or prospective employers. This information can be obtained from various sources, including from involved individuals, organizational files, published material, the Internet and social media.","Conformément à son mandat, la Commission de la fonction publique (CFP) enquête sur des allégations liées à des processus de nomination (fonctionnaires et membres du public) ainsi que sur les cas d’activités politiques irrégulières. Il s’agit notamment d’allégations d’influence politique et de fraude ainsi que d’erreurs, d’omissions ou de conduite irrégulière. Ces dernières comprennent également les erreurs, les omissions ou les conduites irrégulières en lien à des [préjugés et des obstacles qui ont désavantagé les personnes appartenant à tout groupe en quête d’équité](/fr/commission-fonction-publique/services/dotation-fonction-publique/definitions-prejuges-obstacles-desavantagent-groupe-equite.html). Les enquêtes sont menées par la Direction des enquêtes de la CFP en vertu de la *Loi sur l’emploi dans la fonction publique* (LEFP). Les enquêtes menées en vertu de la LEFP impliquent la collecte, l’utilisation, la communication et la conservation de renseignements personnels. Ceux-ci peuvent comprendre des renseignements sur les personnes qui demandent que l’on mène une enquête, les personnes dont les actions font l’objet d’une enquête et les autres personnes impliquées, notamment : nom et coordonnées, code d’identification de dossier personnel ou autres identifiants, date de naissance, renseignements médicaux et liés à des accommodements, renseignements relatifs au statut de groupe en quête d’équité; renseignements d’emploi, allégations, soumissions, témoignages, autres renseignements jugés pertinents et nécessaires pour les besoins d’une enquête, et renseignements sur les employeurs actuels ou éventuels. Ces renseignements peuvent être obtenus de diverses sources, y compris les personnes impliquées, les dossiers organisationnels, les documents publiés, l’Internet et les médias sociaux.","Individuals (public servants and members of the public) involved in an appointment process that is subject to an investigation under the PSEA and other individuals who provide information relevant to the investigation. Also, federal public servants and deputy heads who have been involved in improper political activities that may be perceived as impairing the employee’s ability to perform his or her duties in a politically impartial manner or public servants appointed as a result of political influence.","Individus (fonctionnaires et membres du public) impliqués dans un processus de nomination faisant l’objet d’une enquête en vertu de la LEFP et autres individus qui fournissent des renseignements pertinents à l’enquête. Également, les fonctionnaires fédéraux et administrateurs généraux ayant participé à des activités politiques irrégulières pouvant être perçues comme portant atteinte à la capacité de l’employé d’exercer ses fonctions de manière politiquement impartiale ou les fonctionnaires nommés à la suite d’une influence politique.",Individuals wishing to submit a request for their personal information should provide the relevant investigation file number. A privacy impact assessment was completed in relation to the activities of the PSC’s Investigations activities in March 2019.,"Conformément aux pouvoirs conférés par l’article 19 du *Règlement sur l’emploi dans la fonction publique* et de l’article 14 du *Règlement sur les activités politiques*, la CFP peut également communiquer au public certains renseignements personnels obtenus au cours d’une enquête menée en vertu de la partie 5 ou 7, ou communiquer les renseignements, sans consentement, à d’autres organisations du secteur public ou privé, à des établissements d’enseignement, à des organismes d’application de la loi et des organismes de surveillance professionnelle.",,,"This bank contains information collected or created in accordance with PSC’s investigation authorities flowing from Part 5 or Part 7 of the PSEA. Information described in this bank is used to determine whether the PSC has jurisdiction to investigate alleged irregularities, to determine whether an investigation is warranted, to conduct an investigation and to ensure compliance with corrective actions.","Ce fichier contient des informations collectées ou crées conformément aux pouvoirs d’enquête de la CFP découlant de la partie 5 ou la partie 7 de la LEFP. Les renseignements décrits dans ce fichier sont utilisés afin de déterminer si la CFP a compétence pour enquêter sur les irrégularités présumées, pour déterminer si une enquête est justifiée, pour mener une enquête et pour assurer la conformité aux mesures correctives.","Personal information may be shared with jurisdiction, investigations and quality assurance personnel for staff training and quality assurance activities. The information may also be used or disclosed for non-administrative purposes to PSC program activities in accordance with the authority under the PSEA for the purpose of studies, audit and analytical activities, reporting, surveys and statistical analysis or to allow a PSC program or service to prevent recurrence of an irregularity in the application of the PSEA and protect the integrity of the staffing system.","Les renseignements personnels peuvent être communiqués au personnel de la compétence, des enquêtes et de l’assurance de la qualité pour la formation du personnel et les activités d’assurance de la qualité. Les renseignements peuvent également être utilisés ou divulgués à des fins non administratives aux activités de programme de la CFP conformément à l’autorisation prévue par la LEFP aux fins d’études, d’activités de vérification et d’analyse, de rapports, de sondages, d’analyses statistiques ou pour permettre à un programme ou à un service de la CFP de prévenir la récurrence d’une irrégularité dans l’application de la LEFP et de protéger l’intégrité du système de dotation.","Personal information collected by the PSC for purposes of determining the merits of an allegation and the PSC’s jurisdiction to conduct an investigation, but which is not used to conduct an investigation, is kept for five years. Personal information collected and used for purposes of an investigation is retained for ten years following the completion of an investigation and the resulting corrective actions, as applicable. After these retention periods, information for both purposes are destroyed, except in the case of an ongoing litigation hold or pursuant to any other legal requirements. All documents presented to the Commission as part of the Investigations process as well as all Records of Decision made by the Commission or on its behalf are also retained in the “Records of the Commission” class of personal information in accordance with that class’s retention standard.","Les renseignements personnels qui sont recueillis par la CFP en vue de déterminer le mérite d’une allégation et de déterminer la compétence de la CFP de mener une enquête, mais qui ne sont pas utilisés pour mener une enquête, sont conservés pendant cinq ans. Les renseignements personnels recueillis et utilisés aux fins d’une enquête sont conservés pendant dix ans après la conclusion de l’enquête et des mesures correctives en découlant, le cas échéant. Après ces périodes de conservation, les informations recueillis à ces deux fins sont détruites, sauf dans le cas qu'un avis de conservation de la preuve soit en vigueur ou en vertu de toutes autres exigences légales. Tous les documents présentés à la Commission dans le cadre du processus d’enquête, ainsi que tous les Rapports de décision rendus par la Commission ou en son nom, sont également conservés dans la catégorie de renseignements personnels intitulée « Documents de la Commission », conformément à la norme de conservation de cette classe. **Remarques :** Les personnes souhaitant présenter une demande de leurs renseignements personnels doivent fournir le numéro de dossier d’enquête pertinent. Une évaluation des facteurs relatifs à la vie privée a été effectuée relativement aux activités des enquêtes de la CFP en mars 2019.",2001/025,2001/025,PSC 1.3.3 – 8255,PSC 1.3.3 – 8255,,,001421,001421
