bank_number_key,title_en,title_fr,bank_number_en,bank_number_fr,description_en,description_fr,class_of_individuals_en,class_of_individuals_fr,note_en,note_fr,social_insurance_number_en,social_insurance_number_fr,purpose_en,purpose_fr,consistent_uses_en,consistent_uses_fr,retention_and_disposal_standards_en,retention_and_disposal_standards_fr,rda_number_en,rda_number_fr,related_record_number_en,related_record_number_fr,last_updated_en,last_updated_fr,tbs_registration_en,tbs_registration_fr
PSC PCU 747,Mobility Provisions,Dispositions concernant la mobilité,PSC PCU 747,CFP PCU 747,"This bank contains information concerning individuals formerly employed for at least three years as exempt staff in the office of a minister or the Leader of the Opposition in the Senate or the Leader of the Opposition in the House of Commons, or in any of those offices successively. Such individuals may make a request to the PSC for confirmation of eligibility to apply for advertised internal appointment processes for a period of one year after ceasing to be employed in the above capacity. This bank also contains information concerning persons formerly employed for at least three consecutive years in one or more of the following excluded positions, GGS-S-910 to GGS-S-920, at the OSGG. Such individuals may make a request to the PSC for confirmation of eligibility to apply for advertised internal appointment processes for a period of one year after ceasing to be employed in the above capacity. Personal information may include the following: name; contact information; biographical information; personnel information, including types of periods of leave such as educational, personal, and extended sick leave; language; views and opinions by the individual requesting eligibility; and signature.","Ce fichier contient des renseignements relatifs aux personnes qui ont été employées pendant au moins trois années en tant que membres exonérés du personnel du cabinet d’un ministre ou du titulaire des charges de leader de l’Opposition au Sénat ou de chef de l’Opposition à la Chambre des communes, ou encore de façon successive dans l’un ou l’autre de ces cabinets. Ces personnes ont le droit de déposer à la Commission de la fonction publique (CFP) une demande de confirmation d’admissibilité en vue de présenter leur candidature dans le cadre d’un processus de nomination interne annoncé, pour une période d’un an après avoir cessé leur emploi dans les fonctions susmentionnées. Ce fichier contient aussi des renseignements relatifs aux personnes qui ont occupé pendant au moins trois années consécutives un ou plusieurs des postes exclus au Bureau du secrétaire du gouverneur général (BSGG) portant un numéro allant de GGS-S-910 à GGS-S-920. Ces personnes ont le droit de déposer à la CFP une demande de confirmation d’admissibilité en vue de présenter leur candidature dans le cadre d’un processus de nomination interne annoncé, pour une période d’un an après avoir cessé leur emploi dans les fonctions susmentionnées. Les renseignements personnels peuvent comprendre ce qui suit : le nom, les coordonnées, les données biographiques, les renseignements personnels (dont le type de congé, par exemple le congé d’études, le congé personnel et le congé de maladie prolongé), les préférences linguistiques, les points de vue et les opinions de la personne qui demande une confirmation d’admissibilité, et la signature.","Individuals requesting confirmation of eligibility under the Former Ministers' Staff and Persons Formerly Employed in an Excluded Position at the OSGG mobility provisions, to participate in advertised internal appointment processes.","Les personnes qui présentent une demande de confirmation d’admissibilité selon la Disposition concernant la mobilité des anciens membres du personnel des cabinets de ministres et la Disposition concernant la mobilité des personnes ayant occupé un poste exclu au Bureau du secrétaire du gouverneur général, en vue de participer à un processus de nomination interne annoncé.",,,,,Personal information is collected under the authority of the PSEA and the Office of the Governor General’s Secretary Employment Regulations to confirm if applicants meet the requirements to be eligible to participate in advertised internal appointment processes in accordance with the FMS and Persons Formerly Employed in an Excluded Position at the OSGG mobility provisions.,"Les renseignements personnels sont recueillis en vertu de la LEFP et du Règlement sur l’emploi au Secrétariat du gouverneur général en vue de confirmer si les postulants satisfont aux critères d’admissibilité pour participer à un processus de nomination interne annoncé, conformément à la Disposition concernant la mobilité des anciens membres du personnel des cabinets de ministres et à la Disposition concernant la mobilité des personnes ayant occupé un poste exclu au Bureau du secrétaire du gouverneur général.",Information may be used to validate information on the request for confirmation forms provided by the individual requesting confirmation and the designated compensation authority. Personal information may be shared with the Federal Court during the course of a judicial review in accordance with paragraphs 8(2)(c) and 8(2)(d) of the Privacy Act. Personal information may be used or disclosed for non-administrative purposes as part of PSC program activities in accordance with subsection 8(2) of the Privacy Act for the following activities that are authorized by the PSEA: studies; evaluations; analytical activities; audits; research; reporting; and statistical analysis.,"Les renseignements peuvent servir à valider les renseignements qui figurent sur les formulaires de demande de confirmation présentés par la personne qui demande la confirmation et le responsable de la rémunération désigné. Les renseignements personnels peuvent être communiqués à la Cour fédérale dans le cadre d’un examen judiciaire, en conformité avec les alinéas 8(2)c) et 8(2)d) de la Loi sur la protection des renseignements personnels (LPRP). La CFP pourrait utiliser ou communiquer les renseignements personnels à des fins non administratives, dans le cadre de ses activités de programme, conformément au paragraphe 8(2) de la LPRP, pour les activités ci-après, lesquelles sont autorisées en vertu de la LEFP : les études, les évaluations, les activités d’analyse, les vérifications, la recherche, la production de rapports et les analyses statistiques. **Normes de conservation et d’élimination :** Les dossiers sont conservés pendant 5 ans et ensuite détruits, sauf pour certains dossiers auxquels on reconnaît une valeur historique, qui sont conservés indéfiniment par Bibliothèque et Archives Canada (BAC).","After five years retention at the PSC, records are destroyed, except for those with historical value, which are sent to Library and Archives Canada.",,2001/025,2001/025 **Numéro de la catégorie de documents pertinents :** 1.1.2 – 2430 **Numéro d’enregistrement (SCT) :** 20110276,1.1.2 – 2430,,,,20110276,
PSC PCE 721,"Career Consultation and Development, Diversity Management: Senior Levels","Orientation professionnelle et perfectionnement, gestion de la diversité : niveaux supérieurs",PSC PCE 721,CFP PCE 721,"This bank may contain basic personal information, curricula vitae, general career information and plans, appraisal information and reference checks.","Ce fichier peut contenir des renseignements personnels généraux, curriculum vitae, renseignements généraux sur la carrière et plans de carrière, renseignements d’évaluation et résultats de la vérification des références.","Employment equity designated group members (i.e., women, visible minorities, Aboriginal Peoples and persons with disabilities) at the EX equivalent, EX minus 1 and EX minus 2 levels who have received career consultation and development services.","Membres de groupes visés par l’équité en matière d’emploi (femmes, minorités visibles, Autochtones et personnes handicapées) aux niveaux équivalents à EX, EX moins 1 et EX moins 2, qui ont reçu des services d’orientation professionnelle et de perfectionnement.",,,,,This bank exists in accordance with section 11 of the Public Service Employment Act to maintain a historical record of designated group members seeking career consultation services in order to fulfill their chosen career plans.,Ce fichier existe en vertu de l’article 11 de la LEFP et a été créé pour tenir un registre historique des membres des groupes désignés qui ont recours aux services d’orientation professionnelle afin d’atteindre les objectifs de leur plan de carrière.,"The bank is used to maintain records of meetings with clients and to identify and contact designated group clients eligible to compete for specific EX processes and for referral of clients to developmental assignments in other departments and agencies. Personal information may be routinely used or disclosed by PSC program activities in accordance with subsection 8(2) of the Privacy Act for the following activities: Studies, evaluations, analytical activities, audits, research, reporting and statistical analysis.","Le fichier sert à conserver des données sur les rencontres avec les clients pour communiquer avec les clients des groupes désignés qui peuvent soumettre leur candidature dans le cadre de processus de dotation de certains postes de direction et pour proposer des affectations de perfectionnement à des clients dans d’autres ministères et organismes. En vertu du paragraphe 8(2) de la Loi sur la protection des renseignements personnels, les renseignements personnels peuvent être utilisés ou communiqués régulièrement pour les activités de programme suivantes de la CFP : Études, évaluations, activités d’analyse, vérifications, recherches, production de rapports et analyses statistiques. **Normes de conservation et d’élimination :** Les dossiers sont conservés pendant deux ans après avoir été déclarés inactifs et sont ensuite détruits.","Records are retained for two years after being declared inactive, and then destroyed.",,2001/025,2001/025,PSC 1.2.1 – 2900,CFP 1.2.1 – 2900,,,001466,001466
PSC PCE 746,Executive Resourcing,Ressourcement des cadres de direction,PSC PCE 746,CFP PCE 746,This bank may contain security clearance ratings; language examination results; board reports; letters to unsuccessful candidates; notification (if applicable); Official Languages information forms; job descriptions; statements of merit criteria; résumés; individual candidate reports from the Personnel Psychology Centre; screening and assessment results; reference check results; and lists of qualified candidates. Individuals seeking access to this information are requested to provide the pertinent selection process number.,"Ce fichier peut contenir des évaluations liées aux habilitations de sécurité; des résultats d’examens d’aptitudes linguistiques; des résultats des rapports du comité d’évaluation; des lettres envoyées aux candidats non retenus, des avis (s’il y a lieu), des formulaires d’information sur les langues officielles, des descriptions de travail, des énoncés des critères de mérite, des curriculum vitae, des rapports individuels de candidats du Centre de psychologie du personnel; des résultats de vérification des références et une liste des candidats qualifiés. Les personnes désirant avoir accès à ces renseignements doivent fournir le bon numéro de processus de sélection.",Persons who are included in an Executive Group appointment process administered by the PSC on behalf of client organizations,Les personnes qui ont participé à un processus de nomination de cadres de direction administré par la CFP au nom d’organisations clientes.,The program ceased to exist in July 2013.,Ce programme a cessé d’exister en juillet 2013. **Normes de conservation et d’élimination :** Les dossiers sont conservés pendant cinq ans après la dernière activité administrative et sont ensuite détruits.,,,These banks exists in accordance with section 11 and subsection 30(1) of the PSEA to record and provide information relating to Executive Group selection processes administered by the PSC on behalf of client organizations.,Ce fichier existe en vertu de l’article 11 et du paragraphe 30(1) de la LEFP afin d’enregistrer et de fournir des renseignements concernant les processus de sélection des cadres de direction administrés par la CFP au nom d’organisations clientes.,"This bank is used to provide information relating to Executive Group selection and appointments. On request, information may be disclosed to a participant in an appointment process to explain the reasons for the selection decision. Information in this bank may be obtained from information in the applicant inventories or assessment results and from client organizations. Personal information may be routinely used or disclosed by PSC program activities in accordance with subsection 8(2) of the Privacy Act for the following activities: studies; evaluations; analytical activities; audits; research; reporting; and statistical analysis. The information may be disclosed to the PSC Investigations Directorate (PSC PPU 010) in accordance with section 8(2)(b) of the Privacy Act and the authority under the PSEA.","Ce fichier est utilisé pour fournir des renseignements concernant la sélection et la nomination des cadres de direction. Sur demande, des renseignements peuvent être divulgués aux participants à un processus de nomination pour expliquer les raisons à l’origine de la décision de sélection. Des renseignements de ce fichier peuvent provenir des répertoires des postulants, résultats d’évaluation et organismes clients. La CFP pourrait utiliser ou communiquer les renseignements personnels à des fins non administratives, dans le cadre de ses activités de programme, conformément au paragraphe 8(2) de la LPRP, pour les activités ci-après, lesquelles sont autorisées en vertu de la LEFP : les études, les évaluations, les activités d’analyse, les vérifications, la recherche, la production de rapports et les analyses statistiques. Les renseignements peuvent être divulgués à la Direction des enquêtes de la CFP (CFP PPU 010) conformément au paragraphe 8(2) de la Loi sur la protection des renseignements personnels et à la LEFP.","Records are retained for five years after the last administrative action, and then destroyed.",,2001/025,2001/025,PSC 1.2.1 – 2900,CFP 1.2.1 – 2900,,,001475,001475
PSC PPE 801,Flexibility EX and Special Assignment Pay Plan Positions,Postes de cadre de direction utilisant une marge de manœuvre et postes visés par le Plan de rémunération d’affectation spéciale,PSC PPE 801,CFP PPE 801,"This bank may contain agreements between the employees and organizations involved, administrative correspondence, reports on staffing transactions, approval forms and curricula vitae, as required.","Ce fichier peut contenir des ententes entre les employés et les organisations visées, des pièces de correspondance administrative, des rapports d’opérations de dotation, des formulaires d’approbation et des curriculum vitæ, au besoin.","Public servants at the EX group and level employed by the PSC in unclassified positions at the EX level, and employees of other groups who are employed under the Special Assignment Pay Plan (SAPP).",Cadres de direction embauchés par la CFP à des postes non classifiés du groupe EX et employés d’autres groupes embauchés en vertu du Plan de rémunération d’affectation spéciale (PRAS).,,,,,This bank exists in accordance with the Directive on Executive Compensation to record and control EX employees in unclassified positions and SAPP situations at the PSC.,Ce fichier existe en vertu de la Directive sur la rémunération des cadres supérieurs et a été créé pour consigner et contrôler la situation des cadres de direction embauchés à des postes non classifiés et le recours au PRAS à la CFP.,"This bank is used to administer and maintain data on EXs in unclassified positions and SAPP situations at the PSC. It is also used to report general data to PSC management and TBS, as required. Personal information may be routinely used or disclosed by PSC program activities in accordance with subsection 8(2) of the Privacy Act for the following activities: studies; evaluations; analytical activities; audits; research; reporting; and statistical analysis.","Le fichier sert à administrer et à conserver des données sur les cadres de direction embauchés à des postes non classifiés et le recours au PRAS à la CFP. Il sert également à fournir des renseignements d’ordre général aux gestionnaires de la CFP et au SCT, au besoin. En vertu du paragraphe 8(2) de la Loi sur la protection des renseignements personnels, les renseignements personnels peuvent être utilisés ou communiqués régulièrement pour les activités de programme suivantes de la CFP : Études, évaluations, activités d’analyse, vérifications, recherches, production de rapports et analyses statistiques. **Normes de conservation et d’élimination :** Les dossiers sont conservés pendant cinq ans et sont ensuite détruits.","Records are retained for a period of five years, and then destroyed.",,98/005,98/005,PSC 1.2.1 – 2900,CFP 1.2.1 – 2900,,,001486,001486
PSC PCE 798,Special Measures Program Participants,Participants au Programme des initiatives de mesures spéciales,PSC PCE 798,CFP PCE 798,"This bank may contain information concerning the on-the-job training assignments of participants in the Special Measures Program, including the Access Program, the Visible Minority Employment Program, the National Indigenous Development Program, the Northern Careers Program and the Non-Traditional Occupations Program for Women (e.g., trainee identification, training status, letters of agreement, training plans, release of medical/psychiatric authorization forms, position descriptions, training evaluations, letters of offer and reports on staffing transactions, as well as post-training employment details, including follow-up dates and results).","Ce fichier peut contenir des renseignements sur les affectations de formation en cours d’emploi des personnes ayant suivi le Programme des initiatives de mesures spéciales. Il s’agit d’initiatives telles que le Programme d’accès, le Programme d’emploi pour les minorités visibles, le Programme national de perfectionnement des Autochtones, le Programme des carrières du Grand Nord et le Programme des emplois non traditionnels pour les femmes (p. ex., l’identification des stagiaires, l’information relative à la formation, la lettre d’entente, le plan de formation, le formulaire d’autorisation médicale et psychiatrique, la description du poste, l’évaluation de la formation, les lettres d’offre, les rapports sur les opérations de dotation, ainsi que les détails sur l’emploi à la suite de la formation, y compris les résultats et les dates de suivi).","Individuals participating in the Special Measures Program, including the Access Program for Disabled Persons, the Visible Minority Employment Program, the National Indigenous Development Program, the Northern Careers Program and the Non-Traditional Occupations Program for Women.","Les participants au Programme des initiatives de mesures spéciales, y compris au Programme d’accès pour les personnes handicapées, au Programme d’emploi pour les minorités visibles, au Programme national de perfectionnement des Autochtones, au Programme des carrières du Grand Nord et au Programme des emplois non traditionnels pour les femmes.",This program ceased to exist in 1998.,Ce programme a cessé en 1998.,,,The bank exists in accordance with TBS authority 789462 to record information on participants in the Special Measures Program.,Ce fichier existe en vertu de la décision du Conseil du Trésor 789462 pour consigner les renseignements sur les participants au Programme des initiatives de mesures spéciales.,"The bank is used to monitor the progress of participants and measure the effectiveness of each initiative/program, as well as for statistical and management information reports prepared for the PSC, TBS, federal government departments and agencies and employment equity committees. Personal information may be routinely used or disclosed by PSC program activities in accordance with subsection 8(2) of the Privacy Act for the following activities: studies; evaluations; analytical activities; audits; research; reporting; and statistical analysis.","Le fichier sert à mesurer les progrès des participants et l’efficacité de chaque initiative ou programme, ainsi qu’à produire des rapports statistiques et de gestion de l’information pour la CFP, le SCT, les ministères et organismes fédéraux et les comités pour l’équité en matière d’emploi. En vertu du paragraphe 8(2) de la Loi sur la protection des renseignements personnels, les renseignements personnels peuvent être utilisés ou communiqués régulièrement pour les activités de programme suivantes de la CFP : études, évaluations, activités d’analyse, vérifications, recherches, production de rapports et analyses statistiques. **Normes de conservation et d’élimination :** Les documents papier ou les dossiers officiels sont conservés par les bureaux régionaux de la CFP. Des copies des dossiers peuvent aussi être conservées dans les dossiers des organisations participantes. Les fichiers papier sont conservés pendant cinq ans après la fin de l’affectation et sont ensuite détruits. Les dossiers informatisés seront conservés jusqu’à l’année 2023 et seront ensuite détruits.","The hard-copy or official files are retained by the PSC regional offices. Copies of the files may also be retained in the records of participating organizations. Paper records are retained for five years after the participant has completed the assignment, after which they are destroyed. Machine-readable records will be retained until 2023, and then destroyed.",,2001/025,2001/025,PSC 1.2.1 – 2900,CFP 1.2.1 – 2900,,,002297,002297
