bank_number_key,bank_number_en,bank_number_fr,entry_id_en,entry_id_fr,entry_title_en,entry_title_fr,description_en,description_fr,note_en,note_fr,date_last_modified,class_of_individuals_en,class_of_individuals_fr,purpose_en,purpose_fr,consistent_uses_en,consistent_uses_fr,retention_disposal_en,retention_disposal_fr,rda_number_en,rda_number_fr,related_record_number_en,related_record_number_fr,url_en,url_fr
PSU 941,PSU 941,,psu941,pou941,Internal Audit,Vérification interne,"This bank describes personal information related to a government institution’s internal audit program, or horizontal audits directed, led or performed by the Office of the Comptroller General (Treasury Board of Canada Secretariat) or the Office of the Auditor General. Personal information may include name, contact information, signature, employee identification number, financial information, gender, and other personal information in relevant records held by the institution.","Le présent fichier décrit les renseignements personnels ayant trait à un programme de vérification interne d’une institution fédérale ou aux vérifications horizontales orientées, dirigées ou exécutées par le Bureau du contrôleur général (Secrétariat du Conseil du Trésor du Canada) ou par le Bureau du vérificateur général. Les renseignements personnels peuvent inclure le nom, les coordonnées, la signature, le numéro d’identification d’employé, des renseignements financiers, le sexe, et les renseignements qui figurent dans les documents pertinents détenus par l’institution.",Personal information in the institution’s records may be disclosed to the Office of the Auditor General for the purposes of audits or studies.,Les renseignements personnels qui se trouvent dans les documents de l’institution peuvent être divulgués au Bureau du vérificateur général pour des études ou des vérifications.,,"Employees and former employees of the institution, contractors, representatives of companies.","Les employés et les anciens employés de l’institution, les entrepreneurs, les représentants d’entreprises.","Personal information is used to perform the  institution’s internal audit program. In some cases, the audit program may  include an investigative function (e.g., fraud, investigation). For many  institutions, information is collected pursuant to an internal audit  contemplated in sections 7 and 16.1 or 133 of the Financial Administration Act.  For those institutions not subject to the Act, consult the institution’s Access  to Information and Privacy Coordinator or their legal services to determine the  legal authority for the internal audit for which the collection is required.","Les renseignements personnels servent à mettre en œuvre le programme de vérification interne de l’institution. Dans certains cas, il se peut que le programme de vérification comporte une fonction d’enquête (p. ex., fraude, enquête). Pour nombre d’institutions, les renseignements sont recueillis dans le cadre d’une vérification interne prévue aux articles 7 et 16.1 ou 133 de la Loi sur la gestion des finances publiques. En ce qui concerne les institutions qui ne sont pas assujetties à cette Loi, il faut consulter le coordonnateur de l’accès à  l’information et de la protection des renseignements personnels de l’institution ou ses services juridiques afin de déterminer l’autorité législative pour la vérification interne pour laquelle la collecte est requise.","Information may be shared with responsible managers, and in some cases, the government institution Audit Committee, the Audit Committee of the Board of Directors, the Board of Directors, and/or the Office of the Auditor General. Information may be also be shared with: 1) Human Resources for disciplinary measures (refer to Discipline – PSE 911 ); 2) Security (refer to Security Incidents and Privacy Breaches – PSU 939 ); 3) Investigative personnel and law enforcement agencies in the event of an alleged criminal offence; and 4) consultants performing internal audit work on behalf of the institution’s Chief Audit Executive.  |  Links: Discipline – PSE 911 (https://www.canada.ca/en/treasury-board-secretariat/services/access-information-privacy/access-information/info-source/standard-personal-information-banks.html#pse911); Security Incidents and Privacy Breaches – PSU 939 (https://www.canada.ca/en/treasury-board-secretariat/services/access-information-privacy/access-information/info-source/standard-personal-information-banks.html#psu939)",,"For information about the length of time that specific types of common administrative records are maintained by a government institution, including the final disposition of those records, please contact the institution’s Access to Information and Privacy Coordinator.","Pour connaître la durée de conservation de certains types de documents administratifs communs par une institution fédérale, y compris la destruction finale de ces documents, veuillez communiquer avec le coordonnateur de l’accès à l’information et de la protection des renseignements personnels.",99/004,99/004,,NDP 916,https://www.canada.ca/en/treasury-board-secretariat/services/access-information-privacy/access-information/info-source/standard-personal-information-banks.html#psu941,https://www.canada.ca/fr/secretariat-conseil-tresor/services/acces-information-protection-reseignements-personnels/acces-information/info-source/fichiers-renseignements-personnels-ordinaires.html#pou941
PSU 915,PSU 915,,psu915,pou915,Internal Communications,Communications internes,"This bank describes information used to communicate with individuals internal to the institution and may include employee surveys (which are considered to be public opinion research), internal communications material, internal mailing and distribution lists, success stories, and information posted to social media sites including wikis, blogs, and other collaborative technologies that are utilized or hosted by the institution. Personal information may include name, work contact information, user names and passwords, employee personnel information, biographical information, photographs, video and audio recordings, views and opinions of, or about, individuals, and Internet Protocol routing addresses.","Ce fichier décrit les renseignements utilisés pour communiquer avec les personnes qui travaillent dans l’institution et peut comprendre les sondages auprès des employés (qui sont considérés comme étant de la recherche sur l’opinion publique), le matériel de communication interne, les listes internes d’envoi/de distribution, les histoires de réussite, et l’information publiée dans les sites des médias sociaux, y compris les wikis, les blogues, ainsi que d’autres technologies collaboratives qui sont utilisées ou hébergées par l’institution. Les renseignements personnels peuvent comprendre le nom, les coordonnées au travail, les noms d’utilisateur et les mots de passe, les renseignements personnels de l’employé, les renseignements biographiques, les photos, les enregistrements audio et vidéo, les opinions et points de vue sur, ou concernant, des individus, ainsi que les adresses de transmission du protocole Internet.","This information may be stored in either hard copy format or electronically (e.g., in databases or on websites, including social media applications, etc.). Although Internet Protocol addresses are not specifically requested by an institution, they may be captured electronically when an e-mail is received.","Ces renseignements peuvent être stockés sous forme papier ou électronique (p. ex., dans des bases de données ou dans des sites Web, y compris les applications de médias sociaux, etc.). Bien qu’une institution ne demande pas les adresses du protocole Internet expressément, celles-ci peuvent être saisies de manière électronique à la réception d’un courriel.",,"Employees and other individuals with access to institutional networks including individuals who have prepared information for dissemination, such as publication on the institution’s intranet, or who act as contact points within the institution.",,"Personal information is used to manage internal communications. For many institutions, personal information is collected under the authority of the Financial Administration Act, and in accordance with the Communications Policy of the Government of Canada. For those institutions not subject to the Act or the Policy, consult the institution’s Access to Information and Privacy Coordinator to determine the legal authority for the collection.","Les renseignements personnels sont utilisés pour gérer les communications internes. Pour un bon nombre d’institutions, les renseignements personnels sont recueillis en vertu de la Loi sur la gestion des finances publiques, et conformément à la Politique de communication du gouvernement du Canada. En ce qui concerne les institutions qui ne sont pas assujetties à cette Loi ou politique, il faut consulter le coordonnateur de l’accès à l’information et de la protection des renseignements personnels de l’institution afin de déterminer l’autorité législative pour la collecte.","The names, photographs, recordings and other personal information about individuals who work for the institution may be included in documentation posted on the institution’s intranet: e.g., within speeches, newsletters, etc. Information may be used or disclosed to provide statistical reports to management as well as for program evaluation.",,"For information about the length of time that specific types of common administrative records are maintained by a government institution, including the final disposition of those records, please contact the institution’s Access to Information and Privacy Coordinator.","Pour connaître la durée de conservation de certains types de documents administratifs communs par une institution fédérale, y compris la destruction finale de ces documents, veuillez communiquer avec le coordonnateur de l’accès à l’information et de la protection des renseignements personnels.",Institution-specific,Propre à l’institution,PRN 939,NDP 939,https://www.canada.ca/en/treasury-board-secretariat/services/access-information-privacy/access-information/info-source/standard-personal-information-banks.html#psu915,https://www.canada.ca/fr/secretariat-conseil-tresor/services/acces-information-protection-reseignements-personnels/acces-information/info-source/fichiers-renseignements-personnels-ordinaires.html#pou915
PSU 936,PSU 936,,psu936,pou936,Library Services,Services de bibliothèque,"This bank describes information about individuals who use the facilities, collections, and services of libraries of government institutions. Services may include loans, reference and research, and alerting and current awareness services, including consideration of client requests for new acquisitions. Personal information may include name, contact information, organization affiliation, research topic, other identification numbers, including user card number and expiration date and client barcode number.","Ce fichier décrit l’information sur les personnes qui utilisent les installations, les collections et les services de bibliothèques des institutions fédérales. Les services peuvent comprendre les prêts, les références et la recherche, ainsi que les services d’avertissement et de mises au courant, dont l’évaluation des demandes des clients quant aux nouvelles acquisitions. Les renseignements personnels peuvent comprendre le nom, les coordonnées, l’affiliation de l’organisme, le sujet de recherche, d’autres numéros d’identification, y compris le numéro de carte de l’utilisateur et sa date d’expiration, ainsi que le numéro de code à barres du client.",,,,"Full-and part-time, casual, and term employees of government institutions, agency employees, members of the general public, researchers, and employees of non-government institution libraries.",,"Personal information is used to support the delivery of library services of government institutions, such as identifying user preferences, researching topics, analyzing trends in information needs, processing inter-library loans, and controlling the circulation of material.","Les renseignements personnels sont utilisés dans le but d’appuyer la prestation des services de bibliothèque des institutions fédérales, comme la détermination des préférences des utilisateurs, la recherche selon les sujets, l’analyse des tendances des besoins informationnels, le traitement des prêts entre bibliothèques, et le contrôle de la circulation des documents.",Information may be used or disclosed for program evaluation.,,"For information about the length of time that specific types of common administrative records are maintained by a government institution, including the final disposition of those records, please contact the institution’s Access to Information and Privacy Coordinator.","Pour connaître la durée de conservation de certains types de documents administratifs communs par une institution fédérale, y compris la destruction finale de ces documents, veuillez communiquer avec le coordonnateur de l’accès à l’information et de la protection des renseignements personnels.",98/001,98/001,PRN 944,NDP 944,https://www.canada.ca/en/treasury-board-secretariat/services/access-information-privacy/access-information/info-source/standard-personal-information-banks.html#psu936,https://www.canada.ca/fr/secretariat-conseil-tresor/services/acces-information-protection-reseignements-personnels/acces-information/info-source/fichiers-renseignements-personnels-ordinaires.html#pou936
PSU 937,PSU 937,POU 937,psu937,pou937,Lobbying Act Requirements,Exigences de la Loi sur le lobbying,"This bank describes information collected by designated public office holders (e.g., current and former Deputy Heads, Assistant Deputy Ministers, senior members of the Canadian Forces, etc.) for the verification of lobbyist activities when requested by the Commissioner of Lobbying. Personal information may include name, contact information, financial information, biographical information, date, and time of the communication/lobbying activity, opinions and views of, or about, individuals, and subject matter.","Ce fichier décrit l’information recueillie par les titulaires d’une charge publique désignée (p. ex., les administrateurs généraux actuels et les anciens administrateurs généraux, les sous-ministres adjoints, les cadres supérieurs des Forces canadiennes, etc.) au sujet de la vérification des activités des lobbyistes sur demande du commissaire au lobbying. Les renseignements personnels peuvent comprendre le nom, les coordonnées, de l’information financière, des renseignements biographiques, la date et de l’heure de l’activité de communication/lobbying, ainsi que les opinions et les points de vue des individus sur le sujet.",,,,Designated public office holders and lobbyists as defined in the Lobbying Act.,Les titulaires d’une charge publique et les lobbyistes comme le définit la Loi sur le lobbying.,"Information is collected pursuant to section 5 of the Lobbying Act to verify arranged meetings, telephone calls, and correspondence between public office holders and lobbyists. Lobbyists who have oral, arranged communications with designated public office holders must report these communications to the Commissioner of Lobbying; in turn, designated public officer holders must verify these communications if requested by the Commissioner of Lobbying.","Les renseignements sont recueillis en vertu de l’article 5 de la Loi sur le lobbying pour vérifier les réunions, les appels téléphoniques et la correspondance prévus entre les titulaires de charge publique et les lobbyistes. Les lobbyistes qui prévoient des échanges de vive voix avec des titulaires d’une charge publique désignée doivent rendent compte de ces échanges au commissaire au lobbying; les titulaires d’une charge publique doivent, quant à eux, vérifier ces échanges si le commissaire le demande.",Information may be made accessible to the public via the website of the Office of the Commissioner of Lobbying of Canada (refer to Information-Specific Personal Information Bank Lobbyist Registry - OCL PPU 039 ). Information may be also be used or disclosed for program evaluation.  |  Links: Lobbyist Registry - OCL PPU 039 (https://lobbycanada.gc.ca/eic/site/012.nsf/eng/00843.html),,"For information about the length of time that specific types of common administrative records are maintained by a government institution, including the final disposition of those records, please contact the institution’s Access to Information and Privacy Coordinator.","Pour connaître la durée de conservation de certains types de dossiers administratifs courants par une institution fédérale, y compris la destruction finale de ces dossiers, veuillez communiquer avec le coordonnateur de l’accès à l’information et de la protection des renseignements personnels.",Institution-specific,Propre à l’institution,PRN 904,NDP 904,https://www.canada.ca/en/treasury-board-secretariat/services/access-information-privacy/access-information/info-source/standard-personal-information-banks.html#psu937,https://www.canada.ca/fr/secretariat-conseil-tresor/services/acces-information-protection-reseignements-personnels/acces-information/info-source/fichiers-renseignements-personnels-ordinaires.html#pou937
PSU 919,PSU 919,,psu919,pou919,"Members of Boards, Committees and Councils","Membres de conseils d’administration, de comités et de conseils","This bank describes information used in the identification and selection of individuals to fill positions on institutional Boards, Committees and Councils. The personal information collected may include the following: full name, contact information, official language of choice, date of birth, country of birth, citizenship, gender, marital status, belonging to a minority, Social Insurance Number (SIN), unique identification number (e.g., unique employee number), terms and conditions of appointment including remuneration (e.g., salary, honoraria, per diem rate) and benefits, signature, physical limitations and any other relevant medical information, photographs or other image recordings, educational background, employment status, work history, volunteering history, professional affiliations, credit card and financial institution information, government security clearances, biographical information (including information about family members), conflict of interest declarations, letters of reference/recommendation, appointment date, and duration and resignation dates, if applicable.","Ce fichier décrit les renseignements personnels utilisés dans le processus d’identification et de sélection des personnes qui seront nommées aux conseils d’administration, comités et conseils de diverses institutions. Les renseignements personnels peuvent comprendre : le nom complet de la personne, ses coordonnées, sa langue officielle de préférence, sa date de naissance, son pays natal, sa citoyenneté, son sexe, sa situation de famille, son appartenance à un groupe minoritaire, son numéro d’assurance sociale (NAS), un numéro d’identification exclusif (p. ex., un numéro d’employé unique), les modalités de sa nomination, y compris sa rémunération (p. ex., traitement, honoraires, indemnité quotidienne) et ses avantages sociaux, sa signature, ses limitations physiques et toute autre information médicale pertinente, des photographies ou d’autres enregistrements visuels, sa scolarité, sa situation d’emploi, ses antécédents de travail, ses activités bénévoles, ses affiliations professionnelles, de l’information sur ses cartes de crédit et son établissement bancaire, sa cote de sécurité au gouvernement, des données biographiques (y compris des renseignements sur les membres de sa famille), toute déclaration de conflit d’intérêts, des lettres de référence/de recommandation, la date de nomination, la durée de la nomination et la date de démission, s’il y a lieu.",,,,"Candidates, as well as current and former members of Boards, Committees, and Councils, their family members, and individuals whose names have been provided as personal references.","Les candidats, ainsi que les membres actuels et anciens de conseils d’administration, de comités et de conseils, les membres de leur famille, ainsi que les personnes dont le nom a été donné à titre de référence personnelle.","The personal information collected is used to support the identification and selection of individuals to serve on advisory, oversight or governance bodies. The information may be used to provide advice to the Minister or Head of the institution to fill existing and/or forthcoming vacancies and to maintain an inventory of potential candidates. The personal information is also used to manage the administration of expenses (e.g., travel) and compensation and benefits packages, conduct performance evaluations, maintain an inventory of current and former appointees, record potential conflicts of interest and any compliance action required, and to communicate with these individuals. The authority to collect personal information is found in a number of legislative authorities such as section 9 Department of Employment and Social Development Act and section 22 of the Museums Act. The Social Insurance Number is collected pursuant to the Income Tax Act. Please consult the institution’s Access to Information and Privacy Coordinator to determine the legal authority for the collection by a specific government institution.","Les renseignements personnels recueillis sont utilisés à l’appui de l’identification et de la sélection des personnes qui seront nommées membres d’organes de consultation, de surveillance ou de gouvernance. Ils pourront être utilisés pour conseiller le ministre ou le dirigeant de l’institution fédérale au moment de pourvoir des postes actuellement ou prochainement vacants et pour tenir un répertoire de candidats possibles. Les renseignements personnels servent aussi à gérer l’administration des dépenses (p. ex., les frais de voyage) et les régimes de rémunération et d’avantages sociaux, à évaluer le rendement, à tenir un répertoire des membres actuels et anciens, à enregistrer d’éventuels conflits d’intérêts et toute mesure de conformité nécessaire, ainsi qu’à communiquer avec ces personnes. Le pouvoir de collecter des renseignements personnels est prévu par de nombreuses autorités législatives, comme l’article 9 de la Loi sur le ministère de l’Emploi et du Développement social et l’article 22 de la Loi sur les musées. Le numéro d’assurance sociale est recueilli conformément à la Loi de l’impôt sur le revenu. Veuillez consulter le coordonnateur de l’accès à l’information et de la protection des renseignements personnels de l’institution fédérale afin de déterminer l’autorité législative pour la collecte par une institution fédérale donnée.","This information may be used in the preparation of reports for senior management and broader audiences (e.g., Annual Reports), planning and evaluation purposes, and communications materials (e.g., press releases, biographies, etc.) that may be disseminated in multiple formats, including the institution’s website. With consent of the individual, this information may be shared with other Government of Canada institutions for uses consistent with the mandate of the Board, Committee or Council on which personal information is collected to fill positions (Refer to Members of Boards, Committees and Councils – PSU 919 of the specific government institution). Information may be disclosed to the Canada Revenue Agency (refer to Individual Returns and Payment Processing – CRA PPU 005 ) and, where applicable, the Province of Quebec for income tax purposes. Assistance of third party service providers may be used during the selection process.  |  Links: Individual Returns and Payment Processing – CRA PPU 005 (http://www.cra-arc.gc.ca/gncy/tp/nfsrc/nfsrc-eng.html)",,"For information about the length of time that specific types of common administrative records are maintained by a government institution, including the final disposition of those records, please contact the institution’s Access to Information and Privacy Coordinator.","Veuillez communiquer avec le coordonnateur de l’accès à l’information et de la protection des renseignements personnels de l’institution fédérale pour connaître la durée de conservation, par une institution fédérale, de certains types de documents administratifs communs, y compris leur destruction finale.",Institution-Specific,Propre à l’institution fédérale,PRN 938,NDP 938,https://www.canada.ca/en/treasury-board-secretariat/services/access-information-privacy/access-information/info-source/standard-personal-information-banks.html#psu919,https://www.canada.ca/fr/secretariat-conseil-tresor/services/acces-information-protection-reseignements-personnels/acces-information/info-source/fichiers-renseignements-personnels-ordinaires.html#pou919
