bank_number_key,bank_number_en,bank_number_fr,entry_id_en,entry_id_fr,entry_title_en,entry_title_fr,description_en,description_fr,note_en,note_fr,date_last_modified,class_of_individuals_en,class_of_individuals_fr,purpose_en,purpose_fr,consistent_uses_en,consistent_uses_fr,retention_disposal_en,retention_disposal_fr,rda_number_en,rda_number_fr,related_record_number_en,related_record_number_fr,url_en,url_fr
PSE 912,PSE 912,,pse912,poe912,Employee Performance Management Program,Programme de gestion du rendement des employés,"This bank describes information that is used in support of performance management of employees of the government institution. The personal information may include: name, biographical information, educational information, employee personnel information, medical information, employee identification number, other identification numbers, signature, views and opinions of, and about an individual.","Ce fichier décrit l’information utilisée dans le but d’appuyer la gestion du rendement des employés d’une institution fédérale. Les renseignements personnels peuvent comprendre le nom, les renseignements biographiques, les renseignements sur les études, les renseignements qui figurent au dossier de l’employé, les renseignements médicaux, le numéro d’identification d’employé, d’autres numéros d’identification, la signature et des opinions et points de vue sur, ou concernant, l’individu.",Bank formerly called Performance Management Reviews. Description last updated: March 2014.,,2014-03-01,Employees of the government institution.,Employés de l’institution.,"The personal information is used to assess and rate employee performance against established expectations (work competencies and objectives) and rating scale. The personal information is also used to support decisions in respect of assigning recognition, undertaking remedial action plans, identification of training and development needs, approval of performance compensation and annual increments, promotions, transfers, retention, demotion of employees, termination of employment, extension of probation and rejection of employees on probation, employee assistance and occupational health and safety. For many institutions, personal information is collected pursuant to section 12 of the Financial Administration Act (FAA). For institutions that are not part of the core public administration, consult the institution’s Access to Information Coordinator to determine collection authority.","Les renseignements personnels servent à évaluer et à noter le rendement de l’employé en fonction d’attentes établies (compétences professionnelles et objectifs de travail) et de l’échelle de notation. Les données servent aussi à justifier les décisions relatives à l’attribution d’une reconnaissance, à l’établissement de plans de mesures correctives, à la détermination du besoin de formation et de perfectionnement et à l’approbation de la rémunération au rendement et des hausses annuelles, de même que les décisions concernant les promotions, les mutations, le maintien en fonction, les rétrogradations, la fin d’emploi, la prolongation de la période de stage et le renvoi en cours de stage, ainsi que l’aide aux employés et la santé et la sécurité au travail. Pour plusieurs institutions, les renseignements personnels sont recueillis en vertu de l’article 12 de la Loi sur la gestion des finances publiques (LGFP). En ce qui concerne les institutions qui ne font pas partie de l’administration publique centrale, il faut consulter le coordonnateur de l’accès à l’information et de la protection des renseignements personnels de l’institution afin de déterminer l’autorité législative pour la collecte.","The information may be used or disclosed for the following purposes: reporting to senior management, evaluation, audit, talent management and succession planning, policy analysis, research and statistics. For institutions of the core public administration, information may be shared with Treasury Board of Canada Secretariat, refer to TBS PCE 754 Performance Management Program for Employees . Information may be shared with other programs or activities of the government institution; refer to PSE 911 Discipline , PSE 916 Employee Assistance , PSE 901 Employee Personnel Record , PSE 910 Grievances , PSU 935 Human Resources Planning , PSE 907 Occupational Health and Safety , PSE 904 Pay and Benefits , PSE 920 Recognition Program , PSE 902 Staffing , PSE 905 Training and Development .  |  Links: TBS PCE 754 Performance Management Program for Employees (http://www.tbs-sct.gc.ca/atipo-baiprp/sfg-srg/sfg-srg02-eng.asp#TBSPCE754); PSE 911 Discipline (https://www.canada.ca/en/treasury-board-secretariat/services/access-information-privacy/access-information/info-source/standard-personal-information-banks.html#pse911); PSE 916 Employee Assistance (https://www.canada.ca/en/treasury-board-secretariat/services/access-information-privacy/access-information/info-source/standard-personal-information-banks.html#pse916); PSE 901 Employee Personnel Record (https://www.canada.ca/en/treasury-board-secretariat/services/access-information-privacy/access-information/info-source/standard-personal-information-banks.html#pse901); PSE 910 Grievances (https://www.canada.ca/en/treasury-board-secretariat/services/access-information-privacy/access-information/info-source/standard-personal-information-banks.html#pse910); PSU 935 Human Resources Planning (https://www.canada.ca/en/treasury-board-secretariat/services/access-information-privacy/access-information/info-source/standard-personal-information-banks.html#psu935); PSE 907 Occupational Health and Safety (https://www.canada.ca/en/treasury-board-secretariat/services/access-information-privacy/access-information/info-source/standard-personal-information-banks.html#pse907); PSE 904 Pay and Benefits (https://www.canada.ca/en/treasury-board-secretariat/services/access-information-privacy/access-information/info-source/standard-personal-information-banks.html#pse904); PSE 920 Recognition Program (https://www.canada.ca/en/treasury-board-secretariat/services/access-information-privacy/access-information/info-source/standard-personal-information-banks.html#pse920); PSE 902 Staffing (https://www.canada.ca/en/treasury-board-secretariat/services/access-information-privacy/access-information/info-source/standard-personal-information-banks.html#pse902); PSE 905 Training and Development (https://www.canada.ca/en/treasury-board-secretariat/services/access-information-privacy/access-information/info-source/standard-personal-information-banks.html#pse905)","Les renseignements peuvent être utilisés ou divulgués pour les raisons suivantes : établissement de rapports à la haute direction, évaluation, audit, gestion des talents et planification de la relève, analyse des politiques, recherche et statistique. Dans le cas des institutions faisant partie de l’administration publique centrale, les renseignements peuvent être communiqués au Secrétariat du Conseil du Trésor du Canada; voir SCT PCE 754 Programme de gestion du rendement pour les employés . Les renseignements peuvent être communiqués à d’autres programmes et activités de l’institution; voir POE 911 – Mesures disciplinaires , POE 916 – Aide aux employés , POE 901 – Dossier personnel d’un employé , POE 910 – Griefs , POU 935 – Planification des ressources humaines , POE 907 – Santé et sécurité au travail , POE 904 – Rémunération et avantages , POE 920 – Programme de la reconnaissance , POE 902 – Dotation et POE 905 – Formation et perfectionnement .  |  Links: SCT PCE 754 Programme de gestion du rendement pour les employés (http://www.tbs-sct.gc.ca/atipo-baiprp/sfg-srg/sfg-srg02-fra.asp#SCTPCE754); POE 911 – Mesures disciplinaires (https://www.canada.ca/fr/secretariat-conseil-tresor/services/acces-information-protection-reseignements-personnels/acces-information/info-source/fichiers-renseignements-personnels-ordinaires.html#poe911); POE 916 – Aide aux employés (https://www.canada.ca/fr/secretariat-conseil-tresor/services/acces-information-protection-reseignements-personnels/acces-information/info-source/fichiers-renseignements-personnels-ordinaires.html#poe916); POE 901 – Dossier personnel d’un employé (https://www.canada.ca/fr/secretariat-conseil-tresor/services/acces-information-protection-reseignements-personnels/acces-information/info-source/fichiers-renseignements-personnels-ordinaires.html#poe901); POE 910 – Griefs (https://www.canada.ca/fr/secretariat-conseil-tresor/services/acces-information-protection-reseignements-personnels/acces-information/info-source/fichiers-renseignements-personnels-ordinaires.html#poe910); POU 935 – Planification des ressources humaines (https://www.canada.ca/fr/secretariat-conseil-tresor/services/acces-information-protection-reseignements-personnels/acces-information/info-source/fichiers-renseignements-personnels-ordinaires.html#pou935); POE 907 – Santé et sécurité au travail (https://www.canada.ca/fr/secretariat-conseil-tresor/services/acces-information-protection-reseignements-personnels/acces-information/info-source/fichiers-renseignements-personnels-ordinaires.html#poe9071); POE 904 – Rémunération et avantages (https://www.canada.ca/fr/secretariat-conseil-tresor/services/acces-information-protection-reseignements-personnels/acces-information/info-source/fichiers-renseignements-personnels-ordinaires.html#poe904); POE 920 – Programme de la reconnaissance (https://www.canada.ca/fr/secretariat-conseil-tresor/services/acces-information-protection-reseignements-personnels/acces-information/info-source/fichiers-renseignements-personnels-ordinaires.html#poe920); POE 902 – Dotation (https://www.canada.ca/fr/secretariat-conseil-tresor/services/acces-information-protection-reseignements-personnels/acces-information/info-source/fichiers-renseignements-personnels-ordinaires.html#poe9021); POE 905 – Formation et perfectionnement (https://www.canada.ca/fr/secretariat-conseil-tresor/services/acces-information-protection-reseignements-personnels/acces-information/info-source/fichiers-renseignements-personnels-ordinaires.html#poe905)","For information about the length of time that specific types of common administrative records are maintained by a government institution, including the final disposition of those records, please contact the institution’s Access to Information and Privacy Coordinator.","Pour connaître la durée de conservation de certains types de documents administratifs communs par une institution fédérale, y compris la destruction finale de ces documents, veuillez communiquer avec le coordonnateur de l’accès à l’information et de la protection des renseignements personnels.",98/005,98/005,PRN 946,NDP 946,https://www.canada.ca/en/treasury-board-secretariat/services/access-information-privacy/access-information/info-source/standard-personal-information-banks.html#pse912,https://www.canada.ca/fr/secretariat-conseil-tresor/services/acces-information-protection-reseignements-personnels/acces-information/info-source/fichiers-renseignements-personnels-ordinaires.html#poe912
PSE 901,PSE 901,POE 901,pse901,poe901,Employee Personnel Record,Dossier personnel d’un employé,"This bank describes information about an individual’s employment with government institutions. Personal information may include name, contact information, biographical information (including any military service, professional certifications or designations), citizenship status, date and place of birth, educational information, employee identification number, employment equity information, delegated authorities given or assets loaned to employees (e.g., staffing and financial signing authorities, usage of institutional materiel), alternative work arrangements (e.g., telework, compressed work week), information related to superannuation, benefits, training and development, grievances, security incidents, any other employment-related requirements (e.g., firearms permits, security clearances, passport/visa information), financial information (for pay administration), medical information (including any special needs identified under duty to accommodate, or in the event of an emergency), other identification numbers, signature and Social Insurance Number (SIN). Employment equity information will only be used for the primary purposes, not for the consistent uses listed.","Ce dossier décrit les renseignements sur l’emploi d’une personne dans les institutions fédérales. Les renseignements personnels peuvent comprendre le nom, les coordonnées, les renseignements biographiques (y compris le service militaire, les désignations ou certifications professionnelles), la citoyenneté, la date et le lieu de naissance, les renseignements sur les études, le numéro d’identification d’employé, des renseignements sur l’équité en emploi, les pouvoirs délégués accordés ou les biens prêtés aux employés (p. ex., les pouvoirs de dotation ou de signature de documents financiers, l’utilisation de matériel institutionnel), les réaménagements des horaires de travail (p. ex., télétravail, semaine de travail comprimée), les renseignements liés à la pension de retraite, les avantages sociaux, la formation et le perfectionnement, les griefs, les incidents de sécurité, toute autre exigence liée à l’emploi (p. ex., permis de port d’arme à feu, autorisations de sécurité, renseignements sur le passeport/visa), les renseignements financiers (pour l’administration de la paye), les renseignements médicaux (y compris tous les besoins spéciaux déterminés dans le cadre de l’obligation de prendre des mesures d’adaptation, ou en cas d’urgence), d’autres numéros d’identification, la signature et le numéro d’assurance sociale (NAS). Les informations sur l'équité en matière d'emploi ne seront utilisées qu'aux fins principales, et non pour les utilisations compatibles énumérées.",,,,"Current and former employees of government institutions, emergency contacts of employees, and may also include spouses, dependants, and beneficiaries.",,"Personal information is used to facilitate personnel administration in the employing institution and to ensure continuity and accuracy when an employee is transferred to another institution. For most government institutions, personal information is collected under the authority of the Public Service Employment Act (PSEA). For those institutions not subject to the (PSEA), consult the institution’s Access to Information and Privacy Coordinator to determine the legal authority for the collection. The Social Insurance Number is collected pursuant to the Income Tax Act.","Les renseignements personnels servent à faciliter l’administration du personnel par l’employeur et à assurer la continuité et l’exactitude lorsqu’un employé est transféré dans une autre institution. Pour la plupart des institutions gouvernementales, les renseignements personnels sont recueillis aux termes de la Loi sur l’emploi dans la fonction publique (LEFP). En ce qui concerne les institutions qui ne sont pas assujetties à la LEFP, il faut consulter le coordonnateur de l’accès à l’information et de la protection des renseignements personnels de l’institution afin de déterminer l’autorité législative pour la collecte. Le numéro d’assurance sociale est recueilli conformément à la Loi de l’impôt sur le revenu.","Information is disclosed to Canada Revenue Agency refer to Individual Returns and Payment Processing – CRA PPU 005 and to the Province of Quebec (where applicable) for income tax purposes. Information is also disclosed to Employment and Social Development Canada (ESDC) for employment insurance and pension purposes. Information may also be disclosed to Public Works and Government Services Canada (PWGSC) to facilitate payment of salary including direct deposit refer to Bank Public Service Compensation Systems - PWGSC PCE 705 . Where applicable, information may also be disclosed to various provincial health insurance plans or third-party group insurance companies. Information may be used to confirm the identity of employees for access to government and institutional information technology infrastructure. Where applicable, information may be disclosed to Shared Services Canada (SSC). Selected information is shared with previous employers for the purpose of finalizing payments, including retroactive payments and the recovery of outstanding amounts owing to the Crown. Information may be used for general human resource management purposes, including to verify and report on policy compliance. In instances of suspected non-compliance, information may be disclosed to the institution’s security and/or staff relations officials for further investigations or disciplinary actions (refer to PSU 939 Security Incidents and Privacy Breaches and PSE 911 Discipline ). Information may also be used or disclosed for program evaluation purposes.  |  Links: Individual Returns and Payment Processing – CRA PPU 005 (http://www.cra-arc.gc.ca/gncy/tp/nfsrc/nfsrc-eng.html); Public Service Compensation Systems - PWGSC PCE 705 (http://www.tpsgc-pwgsc.gc.ca/aiprp-atip/ressources-resources/infosource-eng.html); PSU 939 Security Incidents and Privacy Breaches (https://www.canada.ca/en/treasury-board-secretariat/services/access-information-privacy/access-information/information-about-programs-information-holdings/standard-personal-information-banks.html#psu939); PSE 911 Discipline (https://www.canada.ca/en/treasury-board-secretariat/services/access-information-privacy/access-information/information-about-programs-information-holdings/standard-personal-information-banks.html#pse911)",,"For information about the length of time that specific types of common administrative records are maintained by a government institution, including the final disposition of those records, please contact the institution’s Access to Information and Privacy Coordinator.","Pour connaître la durée de conservation de certains types de documents administratifs communs par une institution fédérale, y compris la destruction finale de ces documents, veuillez communiquer avec le coordonnateur de l’accès à l’information et de la protection des renseignements personnels.",98/005 and 98/018,,PRN 920,,https://www.canada.ca/en/treasury-board-secretariat/services/access-information-privacy/access-information/info-source/standard-personal-information-banks.html#pse901,https://www.canada.ca/fr/secretariat-conseil-tresor/services/acces-information-protection-reseignements-personnels/acces-information/info-source/fichiers-renseignements-personnels-ordinaires.html#poe901
PSE 918,PSE 918,,pse918,poe918,Employment Equity and Diversity,Équité en emploi et diversité,"The records containing the information described in this bank include personal information on employees such as education, work history and career aspirations, and training and development, which is collected by means of questionnaires and/or interviews or compiled from employees’ files or automated data systems. The information is collected on a voluntary basis, and respondents are asked to identify whether they are male or female, whether they are an aboriginal person, and whether they have a disability or are a member of a visible minority group. The Personal Record Identifier may be used to identify employees in instances where government institutions are not able to employ an anonymous questionnaire, as well as when these identifiers are required to locate employee records.","Les dossiers contenant les renseignements décrits dans ce fichier comprennent des renseignements personnels sur les employés, notamment sur leurs études; leurs antécédents professionnels et leurs projets de carrière; leur formation et leur perfectionnement. Tous ces renseignements ont été recueillis au moyen de questionnaires ou d’entrevues, ou compilés à partir de leurs dossiers ou des systèmes de données automatisés. Les répondants, qui sont libres de fournir ces renseignements, indiquent leur sexe et s’ils sont autochtones, handicapés ou font partie d’une minorité visible. Le Code d’identification de dossier personnel peut servir à identifier les employés lorsque les institutions fédérales ne peuvent pas utiliser un questionnaire anonyme ou lorsqu’il est nécessaire d’avoir ces indicatifs afin de pouvoir trouver le dossier de l’employé.",,,,Employees of the institution.,Employés de l’institution.,"Related records provide documentation for the implementation of the employment equity policy in government institutions. Data are collected to provide a comprehensive picture of employees by sex and by target group status (e.g., women, aboriginal peoples, persons with disabilities and members of visible minority groups). This information is used to compile a personnel profile of employees and to compare the situation of target group members with non-target group members within a government institution and with their counterparts in the general labour market. The Personal Record Identifier (PRI) may be used to link information in this bank with that in another bank containing employee information (e.g., the Personnel Management Information System) in order to obtain statistical information, where the securing of such information would be consistent with the uses for which the personal information was collected. Self-identification information may be obtained from the institutional records as described in the Standard Personal Information Bank Staffing - PSE 902 .  |  Links: Staffing - PSE 902 (https://www.canada.ca/en/treasury-board-secretariat/services/access-information-privacy/access-information/info-source/standard-personal-information-banks.html#pse902)","Ces dossiers ont pour but de recueillir toute la documentation nécessaire à la mise en œuvre de la politique relative à l’équité en matière d’emploi pour toutes les institutions fédérales. C’est grâce à ces renseignements qu’il est possible d’avoir toutes les données au sujet des employés, présentées selon leur sexe et leur groupe cible (femmes, autochtones et personnes handicapées et personnes faisant partie de minorités visibles). Ces renseignements sont utilisés afin de réaliser un profil personnel des employés et de comparer la situation des membres des groupes cibles avec celles des autres groupes au sein des ministères et organismes fédéraux et avec leurs homologues sur le marché du travail. Le Code d’identification de dossier personnel peut servir à établir un lien entre les renseignements contenus dans ce fichier et ceux conservés dans un autre fichier comprenant des renseignements sur les employés (p. ex., le Système d’information pour la gestion du personnel) et ce, à des fins statistiques et lorsque la conservation de tels renseignements est conforme aux usages pour lesquels les renseignements personnels ont été recueillis. Il est possible d’obtenir des données d’auto-identification des dossiers institutionnels qui sont décrits dans le Fichier de renseignements personnels Dotation – POE 902 .  |  Links: Dotation – POE 902 (https://www.canada.ca/fr/secretariat-conseil-tresor/services/acces-information-protection-reseignements-personnels/acces-information/info-source/fichiers-renseignements-personnels-ordinaires.html#poe9021)","The government institution may collect data for statistical purposes, for purposes relating to individuals, or for both. Personal data are released to the Treasury Board of Canada Secretariat for statistical purposes only (refer to Central Personal Information Bank Employment Equity Data Bank - TBS PCE 739 ). The information gathered will be used for institutional purposes in the government’s employment equity program to identify and eliminate systemic discrimination in employment and to introduce temporary special measures to ensure that target groups participate in and are equitably represented in the federal public service. It may also be used for policy and planning purposes related to employment equity.  |  Links: Employment Equity Data Bank - TBS PCE 739 (http://www.tbs-sct.gc.ca/atipo-baiprp/sfg-srg/sfg-srg02-eng.asp)",,"For information about the length of time that specific types of common administrative records are maintained by a government institution, including the final disposition of those records, please contact the institution’s Access to Information and Privacy Coordinator.","Pour connaître la durée de conservation de certains types de documents administratifs communs par une institution fédérale, y compris la destruction finale de ces documents, veuillez communiquer avec le coordonnateur de l’accès à l’information et de la protection des renseignements personnels.",98/005,98/005,PRN 942,NDP 942,https://www.canada.ca/en/treasury-board-secretariat/services/access-information-privacy/access-information/info-source/standard-personal-information-banks.html#pse918,https://www.canada.ca/fr/secretariat-conseil-tresor/services/acces-information-protection-reseignements-personnels/acces-information/info-source/fichiers-renseignements-personnels-ordinaires.html#poe918
