bank_number_key,bank_number_en,bank_number_fr,entry_id_en,entry_id_fr,entry_title_en,entry_title_fr,description_en,description_fr,note_en,note_fr,date_last_modified,class_of_individuals_en,class_of_individuals_fr,purpose_en,purpose_fr,consistent_uses_en,consistent_uses_fr,retention_disposal_en,retention_disposal_fr,rda_number_en,rda_number_fr,related_record_number_en,related_record_number_fr,url_en,url_fr
PSU 907,PSU 907,,psu907,poe907,Physical Access Controls,Contrôles d’accès physique,"This bank describes information used in support of physical security measures in the form of identification cards, employee and visitor access badges, and video surveillance recordings generated by cameras located on the perimeters of, or within institutionally operated buildings and facilities. Additionally, in support of employee and visitor access control, the records related to these subjects contain the actual access logs/registers used to issue temporary employee passes and temporary visitor passes. Personal information collected may include recorded visual images, photographs, data logs, signatures, surnames, given names, telephone numbers, access badge numbers, temporary pass control numbers and visitor company/organization information related to the issuance of temporary visitor passes.","Ce fichier décrit les renseignements qui servent à la prise de mesures de sécurité physique revêtant la forme de cartes d’identification et de laissez-passer et qui ont trait aux enregistrements de surveillance vidéo situés aux périmètres et à l’intérieur d’immeubles et d’installations. De plus, à l’appui du contrôle d’accès des visiteurs et des employés, les documents connexes contiennent les registres de contrôle d’accès réels qui servent à émettre des laissez-passer pour les employés temporaires et des laissez-passer pour visiteurs. Les renseignements personnels recueillis peuvent comprendre des images enregistrées, des photos, des registres de données, des signatures, des noms et prénoms, des numéros de téléphone, des numéros de cartes d’identification, des numéros de contrôle de laissez-passer temporaires et de l’information sur l’organisation/l’entreprise que représente le visiteur, le tout lié à l’émission de laissez-passer pour visiteurs.",This personal information bank was formerly two separate personal information banks: Security Video Surveillance and Temporary Visitor Access Control Logs and Access Badges PSU 907 and Identification and Access Cards PSE 917.,"Ce fichier de renseignements personnels correspondait auparavant à deux fichiers de renseignements personnels distincts : Surveillance vidéo, registres de contrôle d’accès des visiteurs et laissez-passer POU 907 et Cartes d'identification et laissez-passer POE 917).",,"Employees, and those on assignment or contract and visitors who require access to a government institution or any other person within proximity of video surveillance recording capabilities.","Les employés, les employés en affectation et les contractuels, et les visiteurs qui doivent avoir accès à une institution fédérale ou toute autre personne se trouvant à proximité du champ d’enregistrement de la caméra de surveillance.","The personal information is used to enhance the security of government institutions facilities and of individuals and assets present in such facilities. Video surveillance is sometimes conducted in real time or recordings can be used to investigate past occurrences, security incidents or emergency situations. Access logs/registers, access passes and any other records related to employee and visitor access control may also be used to monitor or investigate current or past security incidents. For many institutions, personal information is collected under the authority of various Acts, including the Financial Administration Act (FAA) and as required under the Policy on Government Security, Public Service Employment Act (PSEA), Criminal Code, and the Defence Production Act (DPA). For those institutions not subject to the FAA, PSEA, DPA, or the Policy on Government Security, consult the institution’s Access to Information and Privacy Coordinator to determine collection authority.","Ces renseignements personnels sont utilisés afin d’accroître la sécurité des installations des institutions fédérales, des personnes et des biens présents à l’intérieur de ces installations. La surveillance vidéo est parfois effectuée en temps réel ou les enregistrements peuvent servir à enquêter sur des événements passés, des incidents de sécurité ou des situations d’urgence. Les registres de contrôle d’accès, les laissez-passer et tout autre document lié au contrôle d’accès des visiteurs et des employés peuvent également être utilisés pour surveiller des incidents de sécurité actuels ou passés ou pour faire enquête. Pour un bon nombre d’institutions, les renseignements personnels sont recueillis en vertu de diverses lois, notamment la Loi sur la gestion des finances publiques (LGFP) et conformément à la Politique du gouvernement sur la sécurité, à la Loi sur l’emploi dans la fonction publique (LEFP), au Code criminel du Canada et à la Loi sur la production de défense (LPD). En ce qui concerne les institutions qui ne sont pas assujetties à la LGFP, à la LEFP, à la LPD et à la Politique sur la sécurité du gouvernement, il faut consulter le coordonnateur de l’accès à l’information et de la protection des renseignements personnels de l’institution afin de déterminer l’autorité législative pour la collecte.","The  information may be used or disclosed to assist security officials in the  monitoring of activities and/or the issuance of access passes. Information may  be used for identification purposes in support of personnel security screening.  Information may be used to support compliance with other relevant Treasury Board policy instruments and policy directions. Additionally, records and recordings may record entry  and exit times from facilities and may be used in the event of security-related  incidents such as thefts or emergency situations. In such cases, this  information may be shared with appropriate law enforcement agencies, emergency  workers, appropriate staff relations officers, or investigative bodies for  further investigations, charges or disciplinary actions (refer to Security  Incidents and Privacy Breaches PSU 939 and Discipline  PSE 911 ). Video information that reveals evidence of illegal activity,  employee misconduct or accidents may be disclosed to appropriate staff  relations, facility owners, enforcement or investigative bodies for further  investigations, charges or disciplinary actions.  |  Links: Security  Incidents and Privacy Breaches PSU 939 (https://www.canada.ca/en/treasury-board-secretariat/services/access-information-privacy/access-information/information-about-programs-information-holdings/standard-personal-information-banks.html#psu939); Discipline  PSE 911 (https://www.canada.ca/en/treasury-board-secretariat/services/access-information-privacy/access-information/information-about-programs-information-holdings/standard-personal-information-banks.html#pse911)",,"For information about the length of time that specific types of common administrative records are maintained by a government institution, including the final disposition of those records, please contact the institution’s Access to Information and Privacy Coordinator.","Pour connaître la durée de conservation de certains types de dossiers administratifs courants par une institution fédérale, y compris la destruction finale de ces dossiers, veuillez communiquer avec le coordonnateur de l’accès à l’information et de la protection des renseignements personnels.",98/001,98/001,PRN 931,NDP 931,https://www.canada.ca/en/treasury-board-secretariat/services/access-information-privacy/access-information/info-source/standard-personal-information-banks.html#psu907,https://www.canada.ca/fr/secretariat-conseil-tresor/services/acces-information-protection-reseignements-personnels/acces-information/info-source/fichiers-renseignements-personnels-ordinaires.html#poe907
PSU 912,PSU 912,,psu912,pou912,Professional Services Contracts,Marchés de services professionnels,"This bank describes information contained in agreements between government institutions and a person or firm to provide goods, perform services, to construct works or to lease real property. Personal information may include name, contact information (including business name), biographical information, educational information, financial information, evaluations/assessments, Social Insurance Number (SIN), other identification number (e.g. Business Number) and signature.","Ce fichier décrit les renseignements contenus dans les ententes conclues entre les institutions fédérales, et une personne ou une société, afin de fournir des biens ou des services, de construire des ouvrages ou de louer des biens réels. Les renseignements personnels peuvent comprendre le nom, les coordonnées (y compris le nom commercial), les renseignements biographiques, les renseignements sur les études, les renseignements financiers, les évaluations/analyses, le numéro d’assurance sociale (NAS), un autre numéro d’identification (p. ex., numéro d’entreprise), et la signature.",,,,Individuals representing themselves or employed through private companies (including temporary help services) who have submitted responses to Requests for Proposals and who have been engaged through contracts or standing offers with government institutions and individuals who are provided as professional references.,,"Personal information is used to manage the contracting process, which includes the request for and receipt of proposals, evaluation of bids, selection of contractor, preparation, negotiation, execution, and award of contract, the disbursement of funds for services, deliverables, or both as specified within the contract, and post-contract evaluation. For most government institutions, personal information is collected under the authority of the Financial Administration Act. For those institutions not subject to the Act, consult the institution’s Access to Information and Privacy Coordinator to determine collection authority. The SIN is collected pursuant to the Income Tax Act.","Les renseignements personnels sont utilisés pour gérer le processus de passation des marchés, qui comprend la demande et la réception des propositions, l’évaluation des soumissions, la sélection de l’entrepreneur, la préparation, la négociation, l’exécution, et l’attribution du marché, le décaissement de fonds pour les services, les produits livrables, ou les deux selon les spécifications du marché, ainsi que l’évaluation de l’exécution du marché. Pour la plupart des institutions fédérales, les renseignements personnels sont recueillis en vertu de la Loi sur la gestion des finances publiques. En ce qui concerne les institutions qui ne sont pas assujetties à cette Loi, il faut consulter le coordonnateur de l’accès à l’information et de la protection des renseignements personnels de l’institution afin de déterminer l’autorité législative pour la collecte. Le numéro d’assurance sociale est recueilli conformément à la Loi de l’impôt sur le revenu.","Information is used to maintain an inventory of potential contractors. Information may also be used to recover overpayments and debts owed to the Crown and, where applicable, to enable execution of orders of garnishment, attachment, or diversion of funds in accordance with the Garnishment, Attachment and Pension Diversion Act and related regulations. Information may be used to confirm the identity of contractors (where required) for access to governmental and institutional websites and databases and for the loan of equipment and/or supplies. Information, including the Social Insurance Number and Business Number, is disclosed to the Canada Revenue Agency in T4A-NR Supplementary and T1204 slips (refer to Individual Returns and Payment Processing – CRA PPU 005 and Business Returns and Payment Processing – CRA PPU 047 ) and the Province of Quebec (if applicable) for tax purposes. The information may be shared with/described in Standard Personal Information Banks Accounts Payable - PSU 931 and Accounts Receivable - PSU 932 for payment administration. Selected information on contracts for $10,000 or more, including the fact that a contractor is a former public servant in receipt of a Public Service Superannuation Act pension, may be made available on institutions’ websites, in compliance with proactive disclosure procedures. Information may also be used or disclosed for evaluation or reporting purposes.  |  Links: Individual Returns and Payment Processing – CRA PPU 005 (http://www.cra-arc.gc.ca/gncy/tp/nfsrc/nfsrc-eng.html); Business Returns and Payment Processing – CRA PPU 047 (http://www.cra-arc.gc.ca/gncy/tp/nfsrc/nfsrc-eng.html); Accounts Payable - PSU 931 (https://www.canada.ca/en/treasury-board-secretariat/services/access-information-privacy/access-information/info-source/standard-personal-information-banks.html#psu931); Accounts Receivable - PSU 932 (https://www.canada.ca/en/treasury-board-secretariat/services/access-information-privacy/access-information/info-source/standard-personal-information-banks.html#psu932)",,"For information about the length of time that specific types of common administrative records are maintained by a government institution, including the final disposition of those records, please contact the institution’s Access to Information and Privacy Coordinator.","Pour connaître la durée de conservation de certains types de documents administratifs communs par une institution fédérale, y compris la destruction finale de ces documents, veuillez communiquer avec le coordonnateur de l’accès à l’information et de la protection des renseignements personnels.",99/004,99/004,PRN 912,NDP 912,https://www.canada.ca/en/treasury-board-secretariat/services/access-information-privacy/access-information/info-source/standard-personal-information-banks.html#psu912,https://www.canada.ca/fr/secretariat-conseil-tresor/services/acces-information-protection-reseignements-personnels/acces-information/info-source/fichiers-renseignements-personnels-ordinaires.html#pou912
PSU 914,PSU 914,,psu914,pou914,Public Communications,Communications publiques,"This bank describes information used to communicate with individuals external to the institution and may include general inquiries (received by e-mail, telephone, mail) and responses, the distribution of public awareness and communications material, the dissemination of reports, publications, and other documentation including the release of previously released access to information packages (informal access requests), success stories, public opinion research, and information posted to social media platforms including wikis, blogs, and other collaborative Internet technologies used or hosted by the institution . Personal information may include name, contact information, user names and passwords, employee personnel information, biographical information, photographs, video and audio recordings, views and opinions of, or about, individuals, and Internet Protocol (IP) routing addresses.","Ce fichier décrit les renseignements utilisés pour communiquer avec les personnes de l’extérieur de l’institution, y compris les demandes de renseignements généraux (reçues par courriel, par téléphone et par courrier) et les réponses, le matériel de sensibilisation et de communication publiques, les rapports, publications, et autre documentation, y compris la diffusion de trousses d’accès à l’information déjà publiées (demandes d’accès informelles) , les histoires de réussite, la recherche sur l’opinion publique, et l’information publiée sur les plateformes de médias sociaux, y compris les wikis, les blogues, ainsi que d’autres technologies d’Internet collaboratives qui sont utilisées ou hébergées par l’institution.","This information may be stored in either hard copy format or electronically (e.g., in databases or on Web sites, including social media applications, etc.). Although Internet Protocol (IP) addresses are not specifically requested by an institution, they may be captured electronically when an email is received. Description last updated: December 2013.","Ces renseignements peuvent être stockés sous forme papier ou électronique (p. ex., dans des bases de données ou dans des sites Web, y compris les applications de médias sociaux, etc.). Bien qu’une institution ne demande pas les adresses du protocole Internet (PI) expressément, elles peuvent être saisies de manière électronique à la réception d’un courriel. Dernière mise à jour de la description : décembre 2013.",2013-12-01,"Members of the public, representatives of private sector organizations and other government institutions (i.e., municipal, provincial/territorial, and international), employees and other representatives of government institutions, who have requested information from, or submitted information to, a government institution; parents and guardians of minors; employees and other individuals with access to institutional networks, including individuals who have prepared information for dissemination, such as publication on the institution’s extranet or internet sites or who act as contact points within the institution.",,"Personal information is used to disseminate information about the functions, programs, and activities of the institution, including about employees of the institution. For many institutions, personal information is collected under the authority of the Financial Administration Act (FAA), and in accordance with the Communications Policy of the Government of Canada. For those institutions not subject to the FAA or the Communications Policy of the Government of Canada, consult the institution’s Access to Information and Privacy Coordinator to determine collection authority.","Les renseignements personnels sont utilisés pour disséminer l’information sur les fonctions, les programmes et les activités de l’institution, y compris sur les employés de l’institution. Pour un bon nombre d’institutions, les renseignements personnels sont recueillis en vertu de la Loi sur la gestion des finances publiques, (LGFP) et conformément à la Politique de communication du gouvernement du Canada. En ce qui concerne les institutions qui ne sont pas assujetties à la LGFP ou à la Politique de communication du gouvernement du Canada, il faut consulter le coordonnateur de l’accès à l’information et de la protection des renseignements personnels de l’institution afin de déterminer l’autorité législative pour la collecte.","The names, photographs, recordings and other personal information about individuals who work for the institution may be included in documentation posted on the institution’s extranet or Internet sites; e.g., within speeches, newsletters, etc. With consent of the individual, information may be shared with other areas of the institution for program-specific mailing/distribution lists and/or telephone lists. Information may be used to moderate public discussion on the social media platforms used by the institution. Responses to enquiries and any other relevant information are accounted for by the institution-specific personal information bank related to the program area that sent the response. Requests for information may be transferred when the requested information, e.g., inquiry or complaint, falls under the responsibility of another institution, refer to Executive Correspondence - PSU 902 . Some information may also be posted on government institutions’ websites for proactive disclosure purposes. Information may also be used or disclosed to provide statistical reports to management as well as for program evaluation.  |  Links: Executive Correspondence - PSU 902 (https://www.canada.ca/en/treasury-board-secretariat/services/access-information-privacy/access-information/info-source/standard-personal-information-banks.html#psu902)",,"For information about the length of time that specific types of common administrative records are maintained by a government institution, including the final disposition of those records, please contact the institution’s Access to Information and Privacy Coordinator.","Pour connaître la durée de conservation de certains types de dossiers administratifs courants par une institution fédérale, y compris la destruction finale de ces dossiers, veuillez communiquer avec le coordonnateur de l’accès à l’information et de la protection des renseignements personnels.",Institution-specific.,Propre à l’institution,PRN 939,NDP 939,https://www.canada.ca/en/treasury-board-secretariat/services/access-information-privacy/access-information/info-source/standard-personal-information-banks.html#psu914,https://www.canada.ca/fr/secretariat-conseil-tresor/services/acces-information-protection-reseignements-personnels/acces-information/info-source/fichiers-renseignements-personnels-ordinaires.html#pou914
